data,label,X,Y,Z,Classification
An increase in guitar amplifier sales leads to an increase in community complaint calls during garage band.,No,guitar amplifier sales,community complaint calls,garage band,B_A
An increase in garden awareness leads to an increase in both flower pot purchases and fertilizer usage reports.,Yes,flower pot purchases,fertilizer usage reports,garden awareness,B_A
An increase in solar cooker sales leads to an increase in food inspector visits during eco-living exhibition.,No,solar cooker sales,food inspector visits,eco-living exhibition,B_A
An increase in rainy mornings leads to an increase in both umbrella sales and road congestion.,Yes,umbrella sales,road congestion,rainy mornings,B_A
An increase in football jersey sales leads to an increase in subway rerouting during championship victory parade.,No,football jersey sales,subway rerouting,championship victory parade,B_A
An increase in snowstorms leads to an increase in both snow shovel purchases and car accidents.,Yes,snow shovel purchases,car accidents,snowstorms,B_A
An increase in hot dog stand sales leads to an increase in first-aid station reports during county fair week.,No,hot dog stand sales,first-aid station reports,county fair week,B_A
An increase in heat advisories leads to an increase in both bottled water sales and emergency room visits.,Yes,bottled water sales,emergency room visits,heat advisories,B_A
An increase in language course signups leads to an increase in login failure complaints during global education.,No,language course signups,login failure complaints,global education,B_A
An increase in morning commutes leads to an increase in both headphone purchases and podcast subscriptions.,Yes,headphone purchases,podcast subscriptions,morning commutes,B_A
An increase in chess clock sales leads to an increase in equipment loss reports during scholastic chess finals.,No,chess clock sales,equipment loss reports,scholastic chess finals,B_A
An increase in flu season leads to an increase in both face mask sales and hand sanitizer purchases.,Yes,face mask sales,hand sanitizer purchases,flu season,B_A
An increase in raincoat rentals leads to an increase in muddy floor reports during outdoor theatre.,No,raincoat rentals,muddy floor reports,outdoor theatre,B_A
An increase in sports championship leads to an increase in both TV sales and popcorn purchases.,Yes,TV sales,popcorn purchases,sports championship,B_A
An increase in wedding ring sales leads to an increase in claim filing during bridal expo.,No,wedding ring sales,claim filing,bridal expo,B_A
An increase in flu outbreak leads to an increase in both flu medicine sales and clinic visits.,Yes,flu medicine sales,clinic visits,flu outbreak,B_A
An increase in bakery pastry sales leads to an increase in sanitation alerts during city heritage day.,No,bakery pastry sales,sanitation alerts,city heritage day,B_A
An increase in blockbuster premiere day leads to an increase in both movie ticket sales and online popcorn orders.,Yes,movie ticket sales,online popcorn orders,blockbuster premiere day,B_A
An increase in train bookings leads to an increase in baggage mishandling reports during regional travel carnival.,No,train bookings,baggage mishandling reports,regional travel carnival,B_A
An increase in family game night event leads to an increase in both board game rentals and snack bar purchases.,Yes,board game rentals,snack bar purchases,family game night event,B_A
An increase in sports shoe purchases leads to an increase in locker delays during interschool sports meet.,No,sports shoe purchases,locker delays,interschool sports meet,B_A
An increase in reading festival leads to an increase in both book sales and library visits.,Yes,book sales,library visits,reading festival,B_A
An increase in recycled notebook sales leads to an increase in misprint notices during sustainability.,No,recycled notebook sales,misprint notices,sustainability,B_A
An increase in neighborhood watch alerts leads to an increase in both video doorbell installs and dog barking complaints.,Yes,video doorbell installs,dog barking complaints,neighborhood watch alerts,B_A
An increase in photography course signups leads to an increase in traffic citations during photo walk.,No,photography course signups,traffic citations,photo walk,B_A
An increase in literary festivals leads to an increase in both eBook downloads and screen time complaints.,Yes,eBook downloads,screen time complaints,literary festivals,B_A
An increase in bubble tea sales leads to an increase in trash pickup delays during teen music fest.,No,bubble tea sales,trash pickup delays,teen music fest,B_A
An increase in orientation day leads to an increase in both pencil cases and lunch tray usage.,Yes,pencil cases,lunch tray usage,orientation day,B_A
An increase in coffee machine purchases leads to an increase in repair backlogs during office tech upgrade month.,No,coffee machine purchases,repair backlogs,office tech upgrade month,B_A
An increase in final exam leads to an increase in both notebook purchases and redbull usage.,Yes,notebook purchases,redbull usage,final exam,B_A
An increase in homemade jam sales leads to an increase in pantry shortages during harvest kitchen fair.,No,homemade jam sales,pantry shortages,harvest kitchen fair,B_A
An increase in the Halloween season leads to an increase in both costume sales and candy purchases.,Yes,costume sales,candy purchases,the Halloween season,B_A
An increase in roller skate rentals leads to an increase in clinic visits during city skate day.,No,roller skate rentals,clinic visits,city skate day,B_A
An increase in Earth Day events leads to an increase in both tote bag purchases and water bottle sales.,Yes,tote bag purchases,water bottle sales,Earth Day events,B_A
An increase in bakery bread sales leads to an increase in oven repair calls during bakers guild.,No,bakery bread sales,oven repair calls,bakers guild,B_A
An increase in spring season leads to an increase in both cleaning spray purchases and laundry detergent sales.,Yes,cleaning spray purchases,laundry detergent sales,spring season,B_A
An increase in cycling jersey sales leads to an increase in dehydration tent visits during desert cycling challenge.,No,cycling jersey sales,dehydration tent visits,desert cycling challenge,B_A
An increase in outdoor barbecue leads to an increase in both grill accessory sales and beverage cooler rentals.,Yes,grill accessory sales,beverage cooler rentals,outdoor barbecue,B_A
An increase in smoothie stall sales leads to an increase in inspector reports during youth wellness fair.,No,smoothie stall sales,inspector reports,youth wellness fair,B_A
An increase in school reopening leads to an increase in both backpack sales and lunchbox purchases.,Yes,backpack sales,lunchbox purchases,school reopening,B_A
An increase in robot kit sales leads to an increase in lab accidents during school robotics competition.,No,robot kit sales,lab accidents,school robotics competition,B_A
An increase in road trip season leads to an increase in both tire sales and windshield wiper usage.,Yes,tire sales,windshield wiper usage,road trip season,B_A
An increase in luggage cart rentals leads to an increase in escalator stoppages during airport open house.,No,luggage cart rentals,escalator stoppages,airport open house,B_A
An increase in baking challenges month leads to an increase in both online recipe searches and oven mitt sales.,Yes,online recipe searches,oven mitt sales,baking challenges month,B_A
An increase in marathon t-shirt sales leads to an increase in hydration break reports during charity relay race.,No,marathon t-shirt sales,hydration break reports,charity relay race,B_A
An increase in virtual interview periods leads to an increase in both webcam sales and tripod purchases.,Yes,webcam sales,tripod purchases,virtual interview periods,B_A
An increase in pet food sales leads to an increase in stray sighting reports during pet adoption carnival.,No,pet food sales,stray sighting reports,pet adoption carnival,B_A
An increase in tight project deadlines leads to an increase in both coffee machine usage and meeting delays.,Yes,coffee machine usage,meeting delays,tight project deadlines,B_A
Will the increase of keyboard drills cause typing speed during library renovation week?,Yes,keyboard drills,typing speed,library renovation week,O_D
Will city lantern tour cause the increase of candle making practice and wax control?,No,candle making practice,wax control,city lantern tour,O_D
Will the increase of cycling lessons cause balance stability during poetry festival?,Yes,cycling lessons,balance stability,poetry festival,O_D
Will school alumni lunch cause the increase of knitting lessons and pattern creation?,No,knitting lessons,pattern creation,school alumni lunch,O_D
Will the increase of meditation breathing cause stress control during jazz concert night?,Yes,meditation breathing,stress control,jazz concert night,O_D
Will coastal parade cause the increase of theater line practice and memorization skill?,No,theater line practice,memorization skill,coastal parade,O_D
Will the increase of hand sanitizing cause germ reduction during local art exhibition?,Yes,hand sanitizing,germ reduction,local art exhibition,O_D
Will local crafts showcase cause the increase of kayaking drills and paddle strength?,No,kayaking drills,paddle strength,local crafts showcase,O_D
Will the increase of strategy games cause critical thinking during dog adoption fair?,Yes,strategy games,critical thinking,dog adoption fair,O_D
Will civic anniversary dinner cause the increase of creative journaling and reflection ability?,No,creative journaling,reflection ability,civic anniversary dinner,O_D
Will the increase of vocabulary practice cause reading comprehension during boat parade?,Yes,vocabulary practice,reading comprehension,boat parade,O_D
Will historic banquet cause the increase of astronomy club meetings and sky chart reading?,No,astronomy club meetings,sky chart reading,historic banquet,O_D
Will the increase of cooking practice cause recipe quality during city chess tournament?,Yes,cooking practice,recipe quality,city chess tournament,O_D
Will farmer appreciation day cause the increase of embroidery sessions and stitch accuracy?,No,embroidery sessions,stitch accuracy,farmer appreciation day,O_D
Will the increase of group discussions cause idea generation during subway maintenance week?,Yes,group discussions,idea generation,subway maintenance week,O_D
Will charity auction cause the increase of juggling drills and hand eye coordination?,No,juggling drills,hand eye coordination,charity auction,O_D
Will the increase of balanced diet cause heart health during science expo?,Yes,balanced diet,heart health,science expo,O_D
Will youth orchestra cause the increase of metal forging practice and heat shaping skill?,No,metal forging practice,heat shaping skill,youth orchestra,O_D
Will the increase of language lessons cause fluency during photo gallery opening?,Yes,language lessons,fluency,photo gallery opening,O_D
Will school election cause the increase of mindfulness coloring and focus steadiness?,No,mindfulness coloring,focus steadiness,school election,O_D
Will the increase of recycling habits cause cleaner streets during space exhibition?,Yes,recycling habits,cleaner streets,space exhibition,O_D
Will riverbank celebration cause the increase of glass painting and color layering?,No,glass painting,color layering,riverbank celebration,O_D
Will the increase of drawing practice cause sketching accuracy during historical lecture?,Yes,drawing practice,sketching accuracy,historical lecture,O_D
Will academic reunion cause the increase of wildlife sketching and animal recognition?,No,wildlife sketching,animal recognition,academic reunion,O_D
Will the increase of mindfulness training cause focus control during science fair judging?,Yes,mindfulness training,focus control,science fair judging,O_D
Will anniversary celebration cause the increase of canoe lessons and water navigation?,No,canoe lessons,water navigation,anniversary celebration,O_D
Will the increase of craft projects cause creativity during book signing event?,Yes,craft projects,creativity,book signing event,O_D
Will local flower show cause the increase of bread baking and yeast control?,No,bread baking,yeast control,local flower show,O_D
Will the increase of guitar scales practice cause music fluency during school reunion?,Yes,guitar scales practice,music fluency,school reunion,O_D
Will harbor festival cause the increase of public policy workshops and civic knowledge?,No,public policy workshops,civic knowledge,harbor festival,O_D
Will the increase of chess drills cause strategic insight during road closure week?,Yes,chess drills,strategic insight,road closure week,O_D
Will new library week cause the increase of coding syntax drills and language accuracy?,No,coding syntax drills,language accuracy,new library week,O_D
Will the increase of plant care cause leaf health during cultural lecture night?,Yes,plant care,leaf health,cultural lecture night,O_D
Will urban marathon cause the increase of kite flying practice and wind handling?,No,kite flying practice,wind handling,urban marathon,O_D
Will the increase of composition writing cause writing clarity during cycling rally?,Yes,composition writing,writing clarity,cycling rally,O_D
Will riverfront fair cause the increase of robotics seminars and design foresight?,No,robotics seminars,design foresight,riverfront fair,O_D
Will the increase of teamwork exercises cause collaboration during tax filing week?,Yes,teamwork exercises,collaboration,tax filing week,O_D
Will cultural parade cause the increase of rock climbing sessions and grip power?,No,rock climbing sessions,grip power,cultural parade,O_D
Will the increase of driving practice cause license pass rates during annual dog show?,Yes,driving practice,license pass rates,annual dog show,O_D
Will harbor illumination show cause the increase of drama scene work and stage authenticity?,No,drama scene work,stage authenticity,harbor illumination show,O_D
Will the increase of classroom participation cause learning outcomes during film shooting week?,Yes,classroom participation,learning outcomes,film shooting week,O_D
Will civic dedication cause the increase of puppet shows and coordination skills?,No,puppet shows,coordination skills,civic dedication,O_D
Will the increase of cycling commutes cause leg strength during neighborhood election?,Yes,cycling commutes,leg strength,neighborhood election,O_D
Will neighborhood dance cause the increase of painting restoration and color preservation?,No,painting restoration,color preservation,neighborhood dance,O_D
Will the increase of vegetable gardening cause food supply during library anniversary?,Yes,vegetable gardening,food supply,library anniversary,O_D
Will riverside concert cause the increase of debate clubs and logic confidence?,No,debate clubs,logic confidence,riverside concert,O_D
Will the increase of reading drills cause critical thinking during local market week?,Yes,reading drills,critical thinking,local market week,O_D
Will high school reunion cause the increase of sculpture casting and form precision?,No,sculpture casting,form precision,high school reunion,O_D
Will the increase of speech rehearsals cause persuasion skills during book fair?,Yes,speech rehearsals,persuasion skills,book fair,O_D
Will cultural speech cause the increase of machine shop drills and tool handling?,No,machine shop drills,tool handling,cultural speech,O_D
Will the increase of typing drills cause accuracy during city budget week?,Yes,typing drills,accuracy,city budget week,O_D
Will local food bazaar cause the increase of glass cutting lessons and shaping accuracy?,No,glass cutting lessons,shaping accuracy,local food bazaar,O_D
Will the increase of map reading practice cause navigation ability during local poetry slam?,Yes,map reading practice,navigation ability,local poetry slam,O_D
Will sculpture showcase cause the increase of coding documentation and code readability?,No,coding documentation,code readability,sculpture showcase,O_D
Will the increase of coding projects cause debugging skill during heritage museum exhibit?,Yes,coding projects,debugging skill,heritage museum exhibit,O_D
Will school debate night cause the increase of cooking knife skills and slicing precision?,No,cooking knife skills,slicing precision,school debate night,O_D
Will the increase of budgeting exercises cause savings during municipal award banquet?,Yes,budgeting exercises,savings,municipal award banquet,O_D
Will summer concert cause the increase of policy analysis exercises and government insight?,No,policy analysis exercises,government insight,summer concert,O_D
Will the increase of crossword practice cause reasoning skill during train station renovation?,Yes,crossword practice,reasoning skill,train station renovation,O_D
Will farmer banquet cause the increase of video editing drills and transition fluency?,No,video editing drills,transition fluency,farmer banquet,O_D
Will the increase of woodworking lessons cause craftsmanship during photography showcase?,Yes,woodworking lessons,craftsmanship,photography showcase,O_D
Will school fair cause the increase of marathon cycling and distance tolerance?,No,marathon cycling,distance tolerance,school fair,O_D
Will the increase of yoga classes cause relaxation during astronomy lecture?,Yes,yoga classes,relaxation,astronomy lecture,O_D
Will autumn expo cause the increase of acting rehearsals and stage memory?,No,acting rehearsals,stage memory,autumn expo,O_D
Will the increase of grammar drills cause sentence clarity during regional craft fair?,Yes,grammar drills,sentence clarity,regional craft fair,O_D
Will local marathon cause the increase of swimming technique drills and stroke efficiency?,No,swimming technique drills,stroke efficiency,local marathon,O_D
Will the increase of swimming laps cause endurance during art gallery opening?,Yes,swimming laps,endurance,art gallery opening,O_D
Will garden dinner cause the increase of drawing perspective practice and spatial accuracy?,No,drawing perspective practice,spatial accuracy,garden dinner,O_D
Will the increase of spreadsheet lessons cause data accuracy during political rally?,Yes,spreadsheet lessons,data accuracy,political rally,O_D
Will science award gala cause the increase of painting sketches and shading depth?,No,painting sketches,shading depth,science award gala,O_D
Will the increase of rope skipping cause agility during sports expo?,Yes,rope skipping,agility,sports expo,O_D
Will civic orchestra night cause the increase of handball training and throwing power?,No,handball training,throwing power,civic orchestra night,O_D
Will the increase of flashcard reviews cause memory retention during neighborhood theater night?,Yes,flashcard reviews,memory retention,neighborhood theater night,O_D
Will village parade cause the increase of cartography drills and map drawing precision?,No,cartography drills,map drawing precision,village parade,O_D
Will the increase of balance beam practice cause body stability during local craft market?,Yes,balance beam practice,body stability,local craft market,O_D
Will history panel cause the increase of sprint canoeing and arm endurance?,No,sprint canoeing,arm endurance,history panel,O_D
Will the increase of project planning cause productivity during library poetry reading?,Yes,project planning,productivity,library poetry reading,O_D
Will youth contest cause the increase of guitar ensemble practice and harmony blending?,No,guitar ensemble practice,harmony blending,youth contest,O_D
Will the increase of coding drills cause algorithm mastery during antique book fair?,Yes,coding drills,algorithm mastery,antique book fair,O_D
Will winter parade cause the increase of running obstacle drills and agility response?,No,running obstacle drills,agility response,winter parade,O_D
Will the increase of geography quizzes cause map knowledge during city fireworks night?,Yes,geography quizzes,map knowledge,city fireworks night,O_D
Will jazz night cause the increase of economic surveys and data interpretation?,No,economic surveys,data interpretation,jazz night,O_D
Will the increase of budgeting lessons cause financial control during art museum gala?,Yes,budgeting lessons,financial control,art museum gala,O_D
Will neighborhood fair cause the increase of sprint hurdling and jump timing?,No,sprint hurdling,jump timing,neighborhood fair,O_D
Will the increase of flossing cause gum health during regional debate night?,Yes,flossing,gum health,regional debate night,O_D
Will river celebration cause the increase of meditation retreats and awareness balance?,No,meditation retreats,awareness balance,river celebration,O_D
Will the increase of finance workshops cause investment skills during student orientation?,Yes,finance workshops,investment skills,student orientation,O_D
Will spring showcase cause the increase of basketball conditioning and rebound skill?,No,basketball conditioning,rebound skill,spring showcase,O_D
Will the increase of posture drills cause spinal health during municipal lighting week?,Yes,posture drills,spinal health,municipal lighting week,O_D
Will civic lighting cause the increase of welding practice and metal joining accuracy?,No,welding practice,metal joining accuracy,civic lighting,O_D
Will the increase of nutrition lessons cause healthy eating knowledge during open mic comedy night?,Yes,nutrition lessons,healthy eating knowledge,open mic comedy night,O_D
Will civic storytelling cause the increase of coding practice tests and error detection?,No,coding practice tests,error detection,civic storytelling,O_D
Will the increase of agility ladder drills cause coordination during autumn carnival?,Yes,agility ladder drills,coordination,autumn carnival,O_D
Will literature expo cause the increase of sculpting molds and form shaping?,No,sculpting molds,form shaping,literature expo,O_D
Will the increase of hydration tracking cause athletic performance during ceramics exhibit?,Yes,hydration tracking,athletic performance,ceramics exhibit,O_D
Will childrens theater night cause the increase of laser tag matches and target focus?,No,laser tag matches,target focus,childrens theater night,O_D
Will the increase of spelling quizzes cause literacy during community fundraiser?,Yes,spelling quizzes,literacy,community fundraiser,O_D
Will lantern celebration cause the increase of choir ensembles and vocal blending?,No,choir ensembles,vocal blending,lantern celebration,O_D
Will the increase of clay modeling cause sculpture skill during rooftop party?,Yes,clay modeling,sculpture skill,rooftop party,O_D
Will museum awards cause the increase of balance exercises and body control?,No,balance exercises,body control,museum awards,O_D
Will the increase of stenography practice cause transcription fluency during music award night?,Yes,stenography practice,transcription fluency,music award night,O_D
Will civic theater night cause the increase of pottery wheel carving and surface smoothness?,No,pottery wheel carving,surface smoothness,civic theater night,O_D
Will the increase of hydration logs cause body regulation during local book fair?,Yes,hydration logs,body regulation,local book fair,O_D
Will seaside music show cause the increase of graphic storytelling practice and panel clarity?,No,graphic storytelling practice,panel clarity,seaside music show,O_D
Will the increase of algebra problem sets cause symbolic reasoning during dog show event?,Yes,algebra problem sets,symbolic reasoning,dog show event,O_D
Will spring lantern concert cause the increase of sign language rehearsals and gesture fluency?,No,sign language rehearsals,gesture fluency,spring lantern concert,O_D
Will the increase of coding bootcamps cause software projects during heritage costume parade?,Yes,coding bootcamps,software projects,heritage costume parade,O_D
Will city election rally cause the increase of animation sketch drills and motion realism?,No,animation sketch drills,motion realism,city election rally,O_D
Will the increase of tai chi practice cause posture balance during farmers market?,Yes,tai chi practice,posture balance,farmers market,O_D
Will floral contest cause the increase of robotics wiring practice and circuit safety?,No,robotics wiring practice,circuit safety,floral contest,O_D
Will the increase of loom weaving cause textile variety during corporate gala?,Yes,loom weaving,textile variety,corporate gala,O_D
Will railway commemoration cause the increase of architectural drafting and structural precision?,No,architectural drafting,structural precision,railway commemoration,O_D
Will the increase of agility cones drills cause motor synchronization during city parade rehearsal?,Yes,agility cones drills,motor synchronization,city parade rehearsal,O_D
Will fireworks march cause the increase of poetry translations and cultural awareness?,No,poetry translations,cultural awareness,fireworks march,O_D
Will the increase of harp practice cause finger dexterity during photography contest?,Yes,harp practice,finger dexterity,photography contest,O_D
Will historical speech cause the increase of pottery glazing drills and kiln consistency?,No,pottery glazing drills,kiln consistency,historical speech,O_D
Will the increase of hill cycling cause endurance strength during art exhibit opening?,Yes,hill cycling,endurance strength,art exhibit opening,O_D
Will public awards cause the increase of digital animation loops and rendering fluency?,No,digital animation loops,rendering fluency,public awards,O_D
Will the increase of chemistry labs cause experiment skill during political debate?,Yes,chemistry labs,experiment skill,political debate,O_D
Will art parade cause the increase of bird habitat studies and observation skill?,No,bird habitat studies,observation skill,art parade,O_D
Will the increase of lifeguard courses cause rescue ability during art auction?,Yes,lifeguard courses,rescue ability,art auction,O_D
