data,label,X,Y,Z,Classification
Will the increase of unstable pump cause pressure flutter during summer night?,Yes,unstable pump,pressure flutter,summer night,O_D
Will the increase of weak speaker cause quiet weekend and the increase of audio hum cause quiet weekend?,No,weak speaker,audio hum,quiet weekend,O_D
Will the increase of erratic socket cause current surge during cloudy shift?,Yes,erratic socket,current surge,cloudy shift,O_D
Will the increase of intermittent sensor cause museum visit and the increase of alignment jitter cause museum visit?,No,intermittent sensor,alignment jitter,museum visit,O_D
Will the increase of noisy screen cause video stutter during city parade?,Yes,noisy screen,video stutter,city parade,O_D
Will the increase of humming antenna cause garden tour and the increase of signal surge cause garden tour?,No,humming antenna,signal surge,garden tour,O_D
Will the increase of sporadic router cause packet blur during winter morning?,Yes,sporadic router,packet blur,winter morning,O_D
Will the increase of training frequency cause surprise inspection and the increase of strength gain cause surprise inspection?,No,training frequency,strength gain,surprise inspection,O_D
Will the increase of neon shimmer cause eye flutter during comet passage?,Yes,neon shimmer,eye flutter,comet passage,O_D
Will the increase of glacier water cause harbor dawn and the increase of tooth zing cause harbor dawn?,No,glacier water,tooth zing,harbor dawn,O_D
Will the increase of linen collar cause neck prickle during orchard dusk?,Yes,linen collar,neck prickle,orchard dusk,O_D
Will the increase of sunlight hours cause building lockdown and the increase of melanin production cause building lockdown?,No,sunlight hours,melanin production,building lockdown,O_D
Will the increase of soaked socks cause foot chill during theater night?,Yes,soaked socks,foot chill,theater night,O_D
Will the increase of thunder clap cause garden brunch and the increase of startle jolt cause garden brunch?,No,thunder clap,startle jolt,garden brunch,O_D
Will the increase of chili broth cause mouth sweat during winter pageant?,Yes,chili broth,mouth sweat,winter pageant,O_D
Will the increase of fresh varnish cause summer bonfire and the increase of nose sting cause summer bonfire?,No,fresh varnish,nose sting,summer bonfire,O_D
Will the increase of firm mattress cause back twinge during valley sunset?,Yes,firm mattress,back twinge,valley sunset,O_D
Will the increase of long kneeling cause mountain sunrise and the increase of leg numbness cause mountain sunrise?,No,long kneeling,leg numbness,mountain sunrise,O_D
Will the increase of push switch cause light on during dog sleep?,Yes,push switch,light on,dog sleep,O_D
Will the increase of spicy dip cause fireworks night and the increase of tongue burn cause fireworks night?,No,spicy dip,tongue burn,fireworks night,O_D
Will the increase of musky perfume cause head swirl during sunset ferry?,Yes,musky perfume,head swirl,sunset ferry,O_D
Will the increase of strobe burst cause moonlit stroll and the increase of pupil shrink cause moonlit stroll?,No,strobe burst,pupil shrink,moonlit stroll,O_D
Will the increase of stale espresso cause stomach lurch during parade afternoon?,Yes,stale espresso,stomach lurch,parade afternoon,O_D
Will the increase of climb hill cause phone ring and the increase of view far cause phone ring?,No,climb hill,view far,phone ring,O_D
Will the increase of sharp garlic cause eye water during carnival evening?,Yes,sharp garlic,eye water,carnival evening,O_D
Will the increase of sweet donut cause market afternoon and the increase of energy rush cause market afternoon?,No,sweet donut,energy rush,market afternoon,O_D
Will the increase of smoky incense cause cough spell during opera night?,Yes,smoky incense,cough spell,opera night,O_D
Will the increase of cold plunge cause rainy evening and the increase of breath gasp cause rainy evening?,No,cold plunge,breath gasp,rainy evening,O_D
Will the increase of plant rose cause yard nice during book read?,Yes,plant rose,yard nice,book read,O_D
Will the increase of dig hole cause song sing and the increase of dirt pile cause song sing?,No,dig hole,dirt pile,song sing,O_D
Will the increase of steamy sauna cause sweat drip during desert twilight?,Yes,steamy sauna,sweat drip,desert twilight,O_D
Will the increase of screen sparkle cause quiet morning and the increase of blink surge cause quiet morning?,No,screen sparkle,blink surge,quiet morning,O_D
An increase in sun glare leads to more vision strain during printer window.,Yes,sun glare,vision strain,printer window,O_A
An increase in lift weight leads to more sky blue and an increase in muscle big leads to more sky blue.,No,lift weight,muscle big,sky blue,O_A
An increase in loud music leads to more sleep disruption during library closing.,Yes,loud music,sleep disruption,library closing,O_A
An increase in drink water leads to more cat nap and an increase in thirst gone leads to more cat nap.,No,drink water,thirst gone,cat nap,O_A
An increase in late caffeine leads to more heart racing during fire drill.,Yes,late caffeine,heart racing,fire drill,O_A
An increase in tight helmet leads to more cafeteria hours and an increase in head pressure leads to more cafeteria hours.,No,tight helmet,head pressure,cafeteria hours,O_A
An increase in dry shampoo leads to more scalp itching during shuttle hours.,Yes,dry shampoo,scalp itching,shuttle hours,O_A
An increase in read book leads to more quiet hour and an increase in smart mind leads to more quiet hour.,No,read book,smart mind,quiet hour,O_A
An increase in clean room leads to more mom glad during sun set.,Yes,clean room,mom glad,sun set,O_A
An increase in config change leads to more bus schedule and an increase in cache reset leads to more bus schedule.,No,config change,cache reset,bus schedule,O_A
An increase in lamp flicker leads to more headache onset during campus tour.,Yes,lamp flicker,headache onset,campus tour,O_A
An increase in spice overload leads to more badge renewal and an increase in mouth burning leads to more badge renewal.,No,spice overload,mouth burning,badge renewal,O_A
An increase in heavy backpack leads to more shoulder ache during desk cleanup.,Yes,heavy backpack,shoulder ache,desk cleanup,O_A
An increase in eat fruit leads to more summer break and an increase in health boost leads to more summer break.,No,eat fruit,health boost,summer break,O_A
An increase in temperature rise leads to more expansion rate during material lengthening.,Yes,temperature rise,material lengthening,fire drill,O_A
An increase in tell joke leads to more road trip and an increase in friend laugh leads to more road trip.,No,tell joke,friend laugh,road trip,O_A
An increase in oil spill leads to more engine smoke during printer window.,Yes,oil spill,engine smoke,printer window,O_A
An increase in metal scratch leads to more bridge inspection and an increase in paint peel leads to more bridge inspection.,No,metal scratch,paint peel,bridge inspection,O_A
An increase in dust exposure leads to more cough symptoms during garden festival.,Yes,dust exposure,cough symptoms,garden festival,O_A
An increase in late bedtime leads to more maintenance window and an increase in daytime drowsiness leads to more maintenance window.,No,late bedtime,daytime drowsiness,maintenance window,O_A
An increase in tight shoes leads to more toe blisters during training session.,Yes,tight shoes,toe blisters,training session,O_A
An increase in plant tree leads to more spring thaw and an increase in shade grow leads to more spring thaw.,No,plant tree,shade grow,spring thaw,O_A
An increase in short temper leads to more argument flare during server outage.,Yes,short temper,argument flare,server outage,O_A
An increase in high altitude leads to more lunch break and an increase in breathlessness onset leads to more lunch break.,No,high altitude,breathlessness onset,lunch break,O_A
An increase in rough fabric leads to more skin rash during audit meeting.,Yes,rough fabric,skin rash,audit meeting,O_A
An increase in stale meal leads to more route detour and an increase in stomach upset leads to more route detour.,No,stale meal,stomach upset,route detour,O_A
An increase in hot shower leads to more skin dryness during power blackout.,Yes,hot shower,skin dryness,power blackout,O_A
An increase in loud siren leads to more shipment hold and an increase in startle jump leads to more shipment hold.,No,loud siren,startle jump,shipment hold,O_A
An increase in long commute leads to more stress rise during class cancellation.,Yes,long commute,stress rise,class cancellation,O_A
An increase in poor posture leads to more meeting reschedule and an increase in neck stiffness leads to more meeting reschedule.,No,poor posture,neck stiffness,meeting reschedule,O_A
An increase in new glasses leads to more focus shift during service disruption.,Yes,new glasses,focus shift,service disruption,O_A
An increase in fast scrolling leads to more clinic visit and an increase in focus drop leads to more clinic visit.,No,fast scrolling,focus drop,clinic visit,O_A
An increase in fragrant spray leads to more allergy flare during signal blackout.,Yes,fragrant spray,allergy flare,signal blackout,O_A
An increase in cold virus leads to more badge pickup and an increase in fever onset leads to more badge pickup.,No,cold virus,fever onset,badge pickup,O_A
An increase in plant seed leads to more flower bloom during car rust.,Yes,plant seed,flower bloom,car rust,O_A
An increase in smoke exposure leads to more room inspection and an increase in coughing fits leads to more room inspection.,No,smoke exposure,coughing fits,room inspection,O_A
An increase in bright lights leads to more migraine onset during ticket window.,Yes,bright lights,migraine onset,ticket window,O_A
An increase in heavy lifting leads to more ceiling repair and an increase in muscle soreness leads to more ceiling repair.,No,heavy lifting,muscle soreness,ceiling repair,O_A
An increase in long sitting leads to more leg stiffness during store hours.,Yes,long sitting,leg stiffness,store hours,O_A
An increase in candy snack leads to more road resurfacing and an increase in sugar rush leads to more road resurfacing.,No,candy snack,sugar rush,road resurfacing,O_A
An increase in coffee dose leads to more alertness boost during pipeline inspection.,Yes,coffee dose,alertness boost,pipeline inspection,O_A
An increase in study habit leads to more antenna alignment and an increase in score increase leads to more antenna alignment.,No,study habit,score increase,antenna alignment,O_A
An increase in piano practice leads to more finger agility during train delay.,Yes,piano practice,finger agility,train delay,O_A
An increase in meditation habit leads to more schedule posting and an increase in anxiety reduction leads to more schedule posting.,No,meditation habit,anxiety reduction,schedule posting,O_A
An increase in language practice leads to more speaking confidence during hallway repaint.,Yes,language practice,speaking confidence,hallway repaint,O_A
An increase in stretching routine leads to more software update and an increase in flexibility gain leads to more software update.,No,stretching routine,flexibility gain,software update,O_A
An increase in budget tracking leads to more spending awareness during inspection day.,Yes,budget tracking,spending awareness,inspection day,O_A
An increase in sunscreen use leads to more bridge shutdown and an increase in skin protection leads to more bridge shutdown.,No,sunscreen use,skin protection,bridge shutdown,O_A
An increase in practice drills leads to more skill improvement during water cutoff.,Yes,practice drills,skill improvement,water cutoff,O_A
An increase in fix car leads to more bird fly and an increase in ride smooth leads to more bird fly.,No,fix car,ride smooth,bird fly,O_A
An increase in packet loss leads to more call drop during planning meeting.,Yes,packet loss,call drop,planning meeting,O_A
An increase in spice intake leads to more elevator outage and an increase in mouth burning leads to more elevator outage.,No,spice intake,mouth burning,elevator outage,O_A
An increase in cold breeze leads to more throat dryness during desk cleanup.,Yes,cold breeze,throat dryness,desk cleanup,O_A
An increase in voltage increase leads to more power dissipation and an increase in current strength leads to more power dissipation.,No,voltage increase,current strength,power dissipation,O_A
An increase in overtime work leads to more sleep delay during budget review.,Yes,overtime work,sleep delay,budget review,O_A
An increase in code change leads to more lunch meeting and an increase in test failure leads to more lunch meeting.,No,code change,test failure,lunch meeting,O_A
An increase in lens smudge leads to more image blur during inventory check.,Yes,lens smudge,image blur,inventory check,O_A
An increase in perfume mist leads to more train delay and an increase in nose irritation leads to more train delay.,No,perfume mist,nose irritation,train delay,O_A
An increase in bass thump leads to more ear ringing during server downtime.,Yes,bass thump,ear ringing,server downtime,O_A
An increase in sugary soda leads to more policy review and an increase in energy spike leads to more policy review.,No,sugary soda,energy spike,policy review,O_A
An increase in wet towels leads to more mildew smell during safety drill.,Yes,wet towels,mildew smell,safety drill,O_A
An increase in fast typing leads to more airport delay and an increase in wrist soreness leads to more airport delay.,No,fast typing,wrist soreness,airport delay,O_A
An increase in canvas rubbing leads to more thumb blister during evening stroll.,Yes,canvas rubbing,thumb blister,evening stroll,O_A
An increase in rocky road leads to more weekend window and an increase in car bouncing leads to more weekend window.,No,rocky road,car bouncing,weekend window,O_A
An increase in paint dry leads to more wall color during bird fly.,Yes,paint dry,wall color,bird fly,O_A
An increase in flu exposure leads to more meeting reschedule and an increase in fever onset leads to more meeting reschedule.,No,flu exposure,fever onset,meeting reschedule,O_A
An increase in long commute leads to more stress rise during clinic visit.,Yes,long commute,stress rise,clinic visit,O_A
An increase in salt intake leads to more power blackout and an increase in thirst feeling leads to more power blackout.,No,salt intake,thirst feeling,power blackout,O_A
An increase in tell truth leads to more trust gain during leaf fall.,Yes,tell truth,trust gain,leaf fall,O_A
An increase in tight collar leads to more museum closure and an increase in neck rash leads to more museum closure.,No,tight collar,neck rash,museum closure,O_A
An increase in screen time leads to more focus drop during service disruption.,Yes,screen time,focus drop,service disruption,O_A
An increase in loud siren leads to more class cancellation and an increase in startle jump leads to more class cancellation.,No,loud siren,startle jump,class cancellation,O_A
An increase in hard running leads to more knee soreness during internet outage.,Yes,hard running,knee soreness,internet outage,O_A
An increase in hot shower leads to more shipment hold and an increase in skin dryness leads to more shipment hold.,No,hot shower,skin dryness,shipment hold,O_A
An increase in caffeine dose leads to more heart racing during cafeteria closure.,Yes,caffeine dose,heart racing,cafeteria closure,O_A
An increase in reading practice leads to more server outage and an increase in comprehension gain leads to more server outage.,No,reading practice,comprehension gain,server outage,O_A
An increase in yoga session leads to more flexibility gain during morning meeting.,Yes,yoga session,flexibility gain,morning meeting,O_A
An increase in switch reset leads to more dinner break and an increase in signal return leads to more dinner break.,No,switch reset,signal return,dinner break,O_A
An increase in fruit snack leads to more energy lift during map update.,Yes,fruit snack,energy lift,map update,O_A
An increase in music listening leads to more service pause and an increase in mood lift leads to more service pause.,No,music listening,mood lift,service pause,O_A
An increase in code practice leads to more typing speed during clinic hour.,Yes,code practice,typing speed,clinic hour,O_A
An increase in hydration habit leads to more airport wait and an increase in thirst relief leads to more airport wait.,No,hydration habit,thirst relief,airport wait,O_A
An increase in wash hand leads to more germ kill during bell ring.,Yes,wash hand,germ kill,bell ring,O_A
An increase in app update leads to more gallery night and an increase in feature change leads to more gallery night.,No,app update,feature change,gallery night,O_A
An increase in buy gift leads to more friend smile during train pass.,Yes,buy gift,friend smile,train pass,O_A
An increase in glasses cleaning leads to more campus fair and an increase in vision clarity leads to more campus fair.,No,glasses cleaning,vision clarity,campus fair,O_A
An increase in desk setup leads to more comfort rise during policy forum.,Yes,desk setup,comfort rise,policy forum,O_A
An increase in math tutoring leads to more route notice and an increase in score rise leads to more route notice.,No,math tutoring,score rise,route notice,O_A
An increase in pepper meal leads to more mouth heat during server audit.,Yes,pepper meal,mouth heat,server audit,O_A
An increase in nap break leads to more dock meeting and an increase in energy return leads to more dock meeting.,No,nap break,energy return,dock meeting,O_A
An increase in car wash leads to more paint shine during library hour.,Yes,car wash,paint shine,library hour,O_A
An increase in massage session leads to more checkout audit and an increase in muscle relief leads to more checkout audit.,No,massage session,muscle relief,checkout audit,O_A
An increase in rain exposure leads to more shirt soaking during office hour.,Yes,rain exposure,shirt soaking,office hour,O_A
An increase in battery charge leads to more mentor chat and an increase in device uptime leads to more mentor chat.,No,battery charge,device uptime,mentor chat,O_A
An increase in slow breathing leads to more pulse drop during subway wait.,Yes,slow breathing,pulse drop,subway wait,O_A
An increase in study habit leads to more printer jam and an increase in memory gain leads to more printer jam.,No,study habit,memory gain,printer jam,O_A
An increase in salt limit leads to more swelling drop during schedule review.,Yes,salt limit,swelling drop,schedule review,O_A
An increase in mix paint leads to more art class and an increase in new color leads to more art class.,No,mix paint,new color,art class,O_A
An increase in treadmill run leads to more sweat increase during budget call.,Yes,treadmill run,sweat increase,budget call,O_A
An increase in driver practice leads to more weather pause and an increase in steering skill leads to more weather pause.,No,driver practice,steering skill,weather pause,O_A
An increase in sour candy leads to more jaw soreness during morning seminar.,Yes,sour candy,jaw soreness,morning seminar,O_A
An increase in heavy cologne leads to more weekend market and an increase in head throbbing leads to more weekend market.,No,heavy cologne,head throbbing,weekend market,O_A
An increase in salted chips leads to more thirst spike during parking survey.,Yes,salted chips,thirst spike,parking survey,O_A
An increase in type fast leads to more shift end and an increase in work done leads to more shift end.,No,type fast,work done,shift end,O_A
An increase in brush tooth leads to more breath mint during wind blow.,Yes,brush tooth,breath mint,wind blow,O_A
An increase in rough towel leads to more art workshop and an increase in skin itching leads to more art workshop.,No,rough towel,skin itching,art workshop,O_A
An increase in paint fumes leads to more nausea rise during mail pickup.,Yes,paint fumes,nausea rise,mail pickup,O_A
An increase in loud whistle leads to more shift swap and an increase in startle flinch leads to more shift swap.,No,loud whistle,startle flinch,shift swap,O_A
An increase in tight headset leads to more ear soreness during rain delay.,Yes,tight headset,ear soreness,rain delay,O_A
An increase in long texting leads to more road detour and an increase in thumb cramps leads to more road detour.,No,long texting,thumb cramps,road detour,O_A
An increase in stale yogurt leads to more stomach churn during power flicker.,Yes,stale yogurt,stomach churn,power flicker,O_A
An increase in cook meat leads to more star shine and an increase in smell good leads to more star shine.,No,cook meat,smell good,star shine,O_A
An increase in cold drizzle leads to more shoe dampness during train delay.,Yes,cold drizzle,shoe dampness,train delay,O_A
An increase in heavy suitcase leads to more elevator check and an increase in back strain leads to more elevator check.,No,heavy suitcase,back strain,elevator check,O_A
An increase in pay bill leads to more debt less during nose itch.,Yes,pay bill,debt less,nose itch,O_A
An increase in tight ring leads to more budget session and an increase in finger swelling leads to more budget session.,No,tight ring,finger swelling,budget session,O_A
An increase in late snack leads to more stomach reflux during river cruise.,Yes,late snack,stomach reflux,river cruise,O_A
An increase in icy water leads to more garden showcase and an increase in tooth sensitivity leads to more garden showcase.,No,icy water,tooth sensitivity,garden showcase,O_A
An increase in strap pressure leads to more shoulder numbness during library shift.,Yes,strap pressure,shoulder numbness,library shift,O_A
An increase in walk dog leads to more sky blue and an increase in tail wag leads to more sky blue.,No,walk dog,tail wag,sky blue,O_A
An increase in early rising leads to more mood uplift during campus pause.,Yes,early rising,mood uplift,campus pause,O_A
An increase in bike riding leads to more boarding process and an increase in leg burning leads to more boarding process.,No,bike riding,leg burning,boarding process,O_A
An increase in paper cut leads to more finger sting during lunch briefing.,Yes,paper cut,finger sting,lunch briefing,O_A
An increase in mint gum leads to more gallery preview and an increase in breath freshening leads to more gallery preview.,No,mint gum,breath freshening,gallery preview,O_A
An increase in run daily leads to more lung strong during morning mist.,Yes,run daily,lung strong,morning mist,O_A
An increase in static shock leads to more morning rehearsal and an increase in finger tingle leads to more morning rehearsal.,No,static shock,finger tingle,morning rehearsal,O_A
An increase in sour milk leads to more gut twist during weekly seminar.,Yes,sour milk,gut twist,weekly seminar,O_A
An increase in loose cable leads to more night inventory and an increase in screen static leads to more night inventory.,No,loose cable,screen static,night inventory,O_A
An increase in rancid oil leads to more nausea swell during cafeteria break.,Yes,rancid oil,nausea swell,cafeteria break,O_A
An increase in sunburn peel leads to more midday briefing and an increase in skin flake leads to more midday briefing.,No,sunburn peel,skin flake,midday briefing,O_A
An increase in tight mask leads to more nose mark during corridor sweep.,Yes,tight mask,nose mark,corridor sweep,O_A
An increase in hot salsa leads to more printer blackout and an increase in tongue sting leads to more printer blackout.,No,hot salsa,tongue sting,printer blackout,O_A
An increase in icy breeze leads to more teeth chatter during lift outage.,Yes,icy breeze,teeth chatter,lift outage,O_A
An increase in strobe flash leads to more courier delay and an increase in blink spasm leads to more courier delay.,No,strobe flash,blink spasm,courier delay,O_A
An increase in solvent fumes leads to more head ache during badge audit.,Yes,solvent fumes,head ache,badge audit,O_A
An increase in fast sprint leads to more morning briefing and an increase in breath hitch leads to more morning briefing.,No,fast sprint,breath hitch,morning briefing,O_A
An increase in greasy meal leads to more reflux flare during agenda review.,Yes,greasy meal,reflux flare,agenda review,O_A
An increase in tie knot leads to more rain drop and an increase in rope tight leads to more rain drop.,No,tie knot,rope tight,rain drop,O_A
An increase in hard sneezing leads to more nose bleed during cash count.,Yes,hard sneezing,nose bleed,cash count,O_A
An increase in wind chill leads to more evening patrol and an increase in hand numb leads to more evening patrol.,No,wind chill,hand numb,evening patrol,O_A
An increase in bake cake leads to more smell sweet during door squeak.,Yes,bake cake,smell sweet,door squeak,O_A
An increase in cold coffee leads to more drawer audit and an increase in stomach sour leads to more drawer audit.,No,cold coffee,stomach sour,drawer audit,O_A
An increase in dry cookies leads to more throat dry during visitor check.,Yes,dry cookies,throat dry,visitor check,O_A
An increase in bake bread leads to more horn honk and an increase in smell yum leads to more horn honk.,No,bake bread,smell yum,horn honk,O_A
An increase in pay tax leads to more law safe during grass grow.,Yes,pay tax,law safe,grass grow,O_A
An increase in overuse typing leads to more system blackout and an increase in finger cramp leads to more system blackout.,No,overuse typing,finger cramp,system blackout,O_A
An increase in save money leads to more wealth grow during bank holiday.,Yes,save money,wealth grow,bank holiday,O_A
An increase in principal amount leads to more compound return and an increase in interest rate leads to more compound return.,No,principal amount,interest rate,lunch break,O_A
An increase in loud echo leads to more voice strain during parking audit.,Yes,loud echo,voice strain,parking audit,O_A
