data,label,X,Y,Z,Classification
Will the increase of shipment backlog cause logistics briefing and the increase of forklift breakdown cause logistics briefing?,Yes,shipment backlog,forklift breakdown,logistics briefing,B_D
Will the increase of classroom leak cause heater failure during maintenance meeting?,No,classroom leak,heater failure,maintenance meeting,B_D
Will the increase of grant reduction cause budget meeting and the increase of invoice error cause budget meeting?,Yes,grant reduction,invoice error,budget meeting,B_D
Will the increase of harbor dredging cause bridge repaint during schedule planning?,No,harbor dredging,bridge repaint,schedule planning,B_D
Will the increase of lab incident cause review meeting and the increase of privacy complaint cause review meeting?,Yes,lab incident,privacy complaint,review meeting,B_D
Will the increase of key snap cause lock rust during door stuck?,No,key snap,lock rust,door stuck,B_D
Will the increase of tax audit cause finance huddle and the increase of contract renewal cause finance huddle?,Yes,tax audit,contract renewal,finance huddle,B_D
Will the increase of roof damage cause pipe corrosion during repair visit?,No,roof damage,pipe corrosion,repair visit,B_D
Will the increase of temperature breach cause menu review and the increase of label error cause menu review?,Yes,temperature breach,label error,menu review,B_D
Will the increase of drone sighting cause crowd surge during security briefing?,No,drone sighting,crowd surge,security briefing,B_D
Will the increase of shaft vibration cause elevator inspection and the increase of cable fray cause elevator inspection?,Yes,shaft vibration,cable fray,elevator inspection,B_D
Will the increase of fan break cause vent clog during hot room?,No,fan break,vent clog,hot room,B_D
Will the increase of policy draft cause board briefing and the increase of union request cause board briefing?,Yes,policy draft,union request,board briefing,B_D
Will the increase of permit appeal cause traffic study during planning summit?,No,permit appeal,traffic study,planning summit,B_D
Will the increase of accessibility report cause inspection huddle and the increase of lighting defect cause inspection huddle?,Yes,accessibility report,lighting defect,inspection huddle,B_D
Will the increase of customs complaint cause billing dispute during vendor meeting?,No,customs complaint,billing dispute,vendor meeting,B_D
Will the increase of curriculum proposal cause faculty meeting and the increase of lab shortage cause faculty meeting?,Yes,curriculum proposal,lab shortage,faculty meeting,B_D
Will the increase of lost roster cause scratched lens during safety workshop?,No,lost roster,scratched lens,safety workshop,B_D
Will the increase of unsigned invoice cause policy hearing and the increase of jammed printer cause policy hearing?,Yes,unsigned invoice,jammed printer,policy hearing,B_D
Will the increase of delayed appeal cause cracked railing during facilities inspection?,No,delayed appeal,cracked railing,facilities inspection,B_D
Will the increase of misfiled memo cause incident debrief and the increase of flickering monitor cause incident debrief?,Yes,misfiled memo,flickering monitor,incident debrief,B_D
Will the increase of expired permit cause sagging ceiling during compliance review?,No,expired permit,sagging ceiling,compliance review,B_D
Will the increase of duplicate report cause service forum and the increase of muted speaker cause service forum?,Yes,duplicate report,muted speaker,service forum,B_D
Will the increase of wrong contract cause warped door during repair briefing?,No,wrong contract,warped door,repair briefing,B_D
Will the increase of pending request cause network roundtable and the increase of tangled router cause network roundtable?,Yes,pending request,tangled router,network roundtable,B_D
Will the increase of unclear notice cause loose vent during community meeting?,No,unclear notice,loose vent,community meeting,B_D
Will the increase of rejected proposal cause tenant huddle and the increase of chipped tile cause tenant huddle?,Yes,rejected proposal,chipped tile,tenant huddle,B_D
Will the increase of lost receipt cause frayed keyboard during support session?,No,lost receipt,frayed keyboard,support session,B_D
Will the increase of conflicting agenda cause health screening and the increase of moldy carpet cause health screening?,Yes,conflicting agenda,moldy carpet,health screening,B_D
Will the increase of revised schedule cause stuck latch during security briefing?,No,revised schedule,stuck latch,security briefing,B_D
Will the increase of late ticket cause audit seminar and the increase of overheated router cause audit seminar?,Yes,late ticket,overheated router,audit seminar,B_D
Will the increase of missing record cause rusted pipe during budget workshop?,No,missing record,rusted pipe,budget workshop,B_D
Will the increase of unsigned form cause quality review and the increase of glitched switch cause quality review?,Yes,unsigned form,glitched switch,quality review,B_D
Will the increase of delayed notice cause damp window during safety walkthrough?,No,delayed notice,damp window,safety walkthrough,B_D
Will the increase of misfiled ticket cause policy seminar and the increase of blurred camera cause policy seminar?,Yes,misfiled ticket,blurred camera,policy seminar,B_D
Will the increase of expired request cause frozen duct during repair roundtable?,No,expired request,frozen duct,repair roundtable,B_D
Will the increase of duplicate memo cause incident forum and the increase of unstable sensor cause incident forum?,Yes,duplicate memo,unstable sensor,incident forum,B_D
Will the increase of wrong invoice cause cracked stair during facilities briefing?,No,wrong invoice,cracked stair,facilities briefing,B_D
Will the increase of pending appeal cause compliance workshop and the increase of loose window cause compliance workshop?,Yes,pending appeal,loose window,compliance workshop,B_D
Will the increase of unclear proposal cause jammed touchpad during service huddle?,No,unclear proposal,jammed touchpad,service huddle,B_D
Will the increase of rejected contract cause community forum and the increase of warped floor cause community forum?,Yes,rejected contract,warped floor,community forum,B_D
Will the increase of late roster cause muted microphone during network training?,No,late roster,muted microphone,network training,B_D
Will the increase of policy overhaul cause inspection visit and the increase of circuit scorch cause inspection visit?,Yes,policy overhaul,circuit scorch,inspection visit,B_D
Will the increase of license renewal cause lubricant seep during maintenance call?,No,license renewal,lubricant seep,maintenance call,B_D
Will the increase of cable unplug cause restart cycle and the increase of thread stall cause restart cycle?,Yes,cable unplug,thread stall,restart cycle,B_D
Will the increase of rule update cause brake squeal during safety check?,No,rule update,brake squeal,safety check,B_D
Will the increase of funding cap cause service triage and the increase of parts shortage cause service triage?,Yes,funding cap,parts shortage,service triage,B_D
Will the increase of route redesign cause signal drift during schedule revision?,No,route redesign,signal drift,schedule revision,B_D
Will the increase of permit rewrite cause site review and the increase of pipe rupture cause site review?,Yes,permit rewrite,pipe rupture,site review,B_D
Will the increase of tax change cause pricing error during billing review?,No,tax change,pricing error,billing review,B_D
Will the increase of tea spill cause bad drink and the increase of milk sour cause bad drink?,Yes,tea spill,milk sour,bad drink,B_D
Will the increase of weather bulletin cause radar failure during flight briefing?,No,weather bulletin,radar failure,flight briefing,B_D
Will the increase of policy memo cause support huddle and the increase of software deadlock cause support huddle?,Yes,policy memo,software deadlock,support huddle,B_D
Will the increase of contract update cause seal failure during quality inspection?,No,contract update,seal failure,quality inspection,B_D
Will the increase of server hot cause site down and the increase of code bug cause site down?,Yes,server hot,code bug,site down,B_D
Will the increase of route alert cause map error during driver notice?,No,route alert,map error,driver notice,B_D
Will the increase of room shortage cause makeup exam and the increase of grading bug cause makeup exam?,Yes,room shortage,grading bug,makeup exam,B_D
Will the increase of code bug cause disk full during app crash?,No,code bug,disk full,app crash,B_D
Will the increase of shift policy cause checkout slowdown and the increase of scanner break cause checkout slowdown?,Yes,shift policy,scanner break,checkout slowdown,B_D
Will the increase of dns change cause script error during page reload?,No,dns change,script error,page reload,B_D
Will the increase of statute notice cause entry queue and the increase of hinge seize cause entry queue?,Yes,statute notice,hinge seize,entry queue,B_D
Will the increase of storm advisory cause track defect during train reroute?,No,storm advisory,track defect,train reroute,B_D
Will the increase of lens blur cause photo bad and the increase of hand shake cause photo bad?,Yes,lens blur,hand shake,photo bad,B_D
Will the increase of safety mandate cause ladder crack during work stoppage?,No,safety mandate,ladder crack,work stoppage,B_D
Will the increase of hiring pause cause release delay and the increase of kernel upgrade cause release delay?,Yes,hiring pause,kernel upgrade,release delay,B_D
Will the increase of referendum call cause parking petition during public session?,No,referendum call,parking petition,public session,B_D
Will the increase of holiday surge cause help backlog and the increase of receipt mismatch cause help backlog?,Yes,holiday surge,receipt mismatch,help backlog,B_D
An increase in pilot strike leads to more volcanic ash during flight cancellation.,No,pilot strike,volcanic ash,flight cancellation,B_A
An increase in crew shortage leads to more train delay and an increase in signal failure leads to more train delay.,Yes,crew shortage,signal failure,train delay,B_A
An increase in length value leads to more width value during rectangle area.,No,length value,width value,rectangle area,B_A
An increase in ddos attack leads to more network outage and an increase in fiber cut leads to more network outage.,Yes,ddos attack,fiber cut,network outage,B_A
An increase in gas leak leads to more snowstorm warning during campus closure.,No,gas leak,snowstorm warning,campus closure,B_A
An increase in storm cloud leads to more sky dark and an increase in night fall leads to more sky dark.,Yes,storm cloud,night fall,sky dark,B_A
An increase in runway debris leads to more crew shortage during flight delay.,No,runway debris,crew shortage,flight delay,B_A
An increase in payment outage leads to more checkout delay and an increase in barcode error leads to more checkout delay.,Yes,payment outage,barcode error,checkout delay,B_A
An increase in dust pile leads to more pollen float during sneeze fit.,No,dust pile,pollen float,sneeze fit,B_A
An increase in ice melt leads to more floor wet and an increase in pipe leak leads to more floor wet.,Yes,ice melt,pipe leak,floor wet,B_A
An increase in teacher strike leads to more flu outbreak during class cancellation.,No,teacher strike,flu outbreak,class cancellation,B_A
An increase in dns failure leads to more website downtime and an increase in certificate expiry leads to more website downtime.,Yes,dns failure,certificate expiry,website downtime,B_A
An increase in alarm fail leads to more guard sleep during theft risk.,No,alarm fail,guard sleep,theft risk,B_A
An increase in baggage backlog leads to more departure delay and an increase in runway closure leads to more departure delay.,Yes,baggage backlog,runway closure,departure delay,B_A
An increase in cooling failure leads to more security breach during facility shutdown.,No,cooling failure,security breach,facility shutdown,B_A
An increase in inspection failure leads to more container hold and an increase in cargo backlog leads to more container hold.,Yes,inspection failure,cargo backlog,container hold,B_A
An increase in operator error leads to more transformer fire during power blackout.,No,operator error,transformer fire,power blackout,B_A
An increase in laboratory spill leads to more lab shutdown and an increase in ventilation failure leads to more lab shutdown.,Yes,laboratory spill,ventilation failure,lab shutdown,B_A
An increase in union strike leads to more fuel shortage during delivery delay.,No,union strike,fuel shortage,delivery delay,B_A
An increase in seat shortage leads to more boarding delay and an increase in security screening leads to more boarding delay.,Yes,seat shortage,security screening,boarding delay,B_A
An increase in icy road leads to more bald tire during car slide.,No,icy road,bald tire,car slide,B_A
An increase in budget freeze leads to more project halt and an increase in safety violation leads to more project halt.,Yes,budget freeze,safety violation,project halt,B_A
An increase in phishing report leads to more audit finding during security review.,No,phishing report,audit finding,security review,B_A
An increase in storm warning leads to more transit suspension and an increase in bridge collapse leads to more transit suspension.,Yes,storm warning,bridge collapse,transit suspension,B_A
An increase in electrical fire leads to more structural crack during site closure.,No,electrical fire,structural crack,site closure,B_A
An increase in water contamination leads to more water advisory and an increase in pump failure leads to more water advisory.,Yes,water contamination,pump failure,water advisory,B_A
An increase in memory leak leads to more driver conflict during app crash.,No,memory leak,driver conflict,app crash,B_A
An increase in customs strike leads to more border delay and an increase in paperwork error leads to more border delay.,Yes,customs strike,paperwork error,border delay,B_A
An increase in late bus leads to more slow walk during work delay.,No,late bus,slow walk,work delay,B_A
An increase in smoke puff leads to more air grey and an increase in dust cloud leads to more air grey.,Yes,smoke puff,dust cloud,air grey,B_A
An increase in heatwave warning leads to more transformer repair during power shutdown.,No,heatwave warning,transformer repair,power shutdown,B_A
An increase in gas low leads to more trip delay and an increase in tire soft leads to more trip delay.,Yes,gas low,tire soft,trip delay,B_A
An increase in runway icing leads to more aircraft repair during flight delay.,No,runway icing,aircraft repair,flight delay,B_A
An increase in software outage leads to more clinic backlog and an increase in flu outbreak leads to more clinic backlog.,Yes,software outage,flu outbreak,clinic backlog,B_A
An increase in weather advisory leads to more security incident during safety briefing.,No,weather advisory,security incident,safety briefing,B_A
An increase in budget revision leads to more staff briefing and an increase in weather advisory leads to more staff briefing.,Yes,budget revision,weather advisory,staff briefing,B_A
An increase in shipping delay leads to more quality audit during order hold.,No,shipping delay,quality audit,order hold,B_A
An increase in structural crack leads to more site shutdown and an increase in permit suspension leads to more site shutdown.,Yes,structural crack,permit suspension,site shutdown,B_A
An increase in requirement change leads to more hardware shortage during project delay.,No,requirement change,hardware shortage,project delay,B_A
An increase in utility repair leads to more street closure and an increase in parade permit leads to more street closure.,Yes,utility repair,parade permit,street closure,B_A
An increase in security threat leads to more chemical spill during evacuation order.,No,security threat,chemical spill,evacuation order,B_A
An increase in cable theft leads to more service outage and an increase in router failure leads to more service outage.,Yes,cable theft,router failure,service outage,B_A
An increase in heavy box leads to more weak tape during box split.,No,heavy box,weak tape,box split,B_A
An increase in bank outage leads to more payment hold and an increase in fraud review leads to more payment hold.,Yes,bank outage,fraud review,payment hold,B_A
An increase in fraud allegation leads to more contract dispute during court hearing.,No,fraud allegation,contract dispute,court hearing,B_A
An increase in wind advisory leads to more ferry cancellation and an increase in engine failure leads to more ferry cancellation.,Yes,wind advisory,engine failure,ferry cancellation,B_A
An increase in pipe burst leads to more chlorine spill during water shutdown.,No,pipe burst,chlorine spill,water shutdown,B_A
An increase in baggage fire leads to more airport evacuation and an increase in bomb threat leads to more airport evacuation.,Yes,baggage fire,bomb threat,airport evacuation,B_A
An increase in server upgrade leads to more certificate expiry during site downtime.,No,server upgrade,certificate expiry,site downtime,B_A
An increase in heat advisory leads to more beach closure and an increase in lightning warning leads to more beach closure.,Yes,heat advisory,lightning warning,beach closure,B_A
An increase in inventory shrink leads to more safety citation during protocol session.,No,inventory shrink,safety citation,protocol session,B_A
An increase in cyber extortion leads to more crisis briefing and an increase in dam rupture leads to more crisis briefing.,Yes,cyber extortion,dam rupture,crisis briefing,B_A
An increase in court verdict leads to more factory recall during media briefing.,No,court verdict,factory recall,media briefing,B_A
An increase in ant crawl leads to more picnic ruin and an increase in fly land leads to more picnic ruin.,Yes,ant crawl,fly land,picnic ruin,B_A
An increase in data subpoena leads to more labor grievance during legal session.,No,data subpoena,labor grievance,legal session,B_A
An increase in permit renewal leads to more budget summit and an increase in grant reduction leads to more budget summit.,Yes,permit renewal,grant reduction,budget summit,B_A
An increase in market analysis leads to more staffing gap during planning summit.,No,market analysis,staffing gap,planning summit,B_A
An increase in belt rip leads to more pant fall and an increase in zip stuck leads to more pant fall.,Yes,belt rip,zip stuck,pant fall,B_A
An increase in tariff change leads to more forklift breakdown during logistics briefing.,No,tariff change,forklift breakdown,logistics briefing,B_A
An increase in pen dry leads to more note fail and an increase in page tear leads to more note fail.,Yes,pen dry,page tear,note fail,B_A
An increase in equipment shipment leads to more research audit during lab briefing.,No,equipment shipment,research audit,lab briefing,B_A
An increase in marathon permit leads to more traffic briefing and an increase in tunnel repair leads to more traffic briefing.,Yes,marathon permit,tunnel repair,traffic briefing,B_A
An increase in passport delay leads to more security advisory during travel workshop.,No,passport delay,security advisory,travel workshop,B_A
An increase in vaccine shortage leads to more health seminar and an increase in heatwave warning leads to more health seminar.,Yes,vaccine shortage,heatwave warning,health seminar,B_A
An increase in parking dispute leads to more privacy complaint during policy summit.,No,parking dispute,privacy complaint,policy summit,B_A
An increase in rent increase leads to more tenant forum and an increase in utility billing leads to more tenant forum.,Yes,rent increase,utility billing,tenant forum,B_A
An increase in earthquake risk leads to more fraud risk during risk workshop.,No,earthquake risk,fraud risk,risk workshop,B_A
An increase in shift vacancy leads to more staffing briefing and an increase in training mandate leads to more staffing briefing.,Yes,shift vacancy,training mandate,staffing briefing,B_A
An increase in mold report leads to more wiring fault during inspection huddle.,No,mold report,wiring fault,inspection huddle,B_A
An increase in sensor anomaly leads to more engineering forum and an increase in patent filing leads to more engineering forum.,Yes,sensor anomaly,patent filing,engineering forum,B_A
An increase in billing mismatch leads to more tax audit during finance huddle.,No,billing mismatch,tax audit,finance huddle,B_A
An increase in export violation leads to more compliance summit and an increase in antitrust inquiry leads to more compliance summit.,Yes,export violation,antitrust inquiry,compliance summit,B_A
An increase in noise complaint leads to more park proposal during neighborhood forum.,No,noise complaint,park proposal,neighborhood forum,B_A
An increase in theft loss leads to more claims briefing and an increase in hail damage leads to more claims briefing.,Yes,theft loss,hail damage,claims briefing,B_A
An increase in deadline slip leads to more donor visit during project workshop.,No,deadline slip,donor visit,project workshop,B_A
An increase in belt snap leads to more coat open and an increase in zip jam leads to more coat open.,Yes,belt snap,zip jam,coat open,B_A
An increase in software bug leads to more power surge during system restart.,No,software bug,power surge,system restart,B_A
An increase in glue dry leads to more box open and an increase in tape rip leads to more box open.,Yes,glue dry,tape rip,box open,B_A
An increase in signal failure leads to more engine issue during train delay.,No,signal failure,engine issue,train delay,B_A
An increase in storm wind leads to more roof collapse and an increase in termite rot leads to more roof collapse.,Yes,storm wind,termite rot,roof collapse,B_A
An increase in relay fault leads to more operator error during power outage.,No,relay fault,operator error,power outage,B_A
An increase in radius size leads to more cylinder volume and an increase in height size leads to more cylinder volume.,Yes,radius size,height size,cylinder volume,B_A
An increase in storm warning leads to more chemical shipment during safety briefing.,No,storm warning,chemical shipment,safety briefing,B_A
An increase in map lost leads to more way lost and an increase in gps dead leads to more way lost.,Yes,map lost,gps dead,way lost,B_A
An increase in roof leak leads to more gas odor during inspection day.,No,roof leak,gas odor,inspection day,B_A
An increase in router upgrade leads to more maintenance window and an increase in database patch leads to more maintenance window.,Yes,router upgrade,database patch,maintenance window,B_A
An increase in lease renewal leads to more grant deadline during planning meeting.,No,lease renewal,grant deadline,planning meeting,B_A
An increase in patient surge leads to more clinic backlog and an increase in staff absence leads to more clinic backlog.,Yes,patient surge,staff absence,clinic backlog,B_A
An increase in order surge leads to more carrier shortage during order backlog.,No,order surge,carrier shortage,order backlog,B_A
An increase in runway repair leads to more departure delay and an increase in baggage jam leads to more departure delay.,Yes,runway repair,baggage jam,departure delay,B_A
An increase in fuel shortage leads to more lane closure during traffic slowdown.,No,fuel shortage,lane closure,traffic slowdown,B_A
An increase in dust storm leads to more air advisory and an increase in chemical odor leads to more air advisory.,Yes,dust storm,chemical odor,air advisory,B_A
An increase in precipitation level leads to more temperature range during river volume.,No,precipitation level,temperature range,river volume,B_A
An increase in staffing gap leads to more call queue and an increase in system glitch leads to more call queue.,Yes,staffing gap,system glitch,call queue,B_A
An increase in barcode smear leads to more price mismatch during checkout pause.,No,barcode smear,price mismatch,checkout pause,B_A
An increase in cat scratch leads to more vet visit and an increase in dog bite leads to more vet visit.,Yes,cat scratch,dog bite,vet visit,B_A
An increase in speaker cancel leads to more power issue during event postponement.,No,speaker cancel,power issue,event postponement,B_A
An increase in loud dog leads to more sleep loss and an increase in thin wall leads to more sleep loss.,Yes,loud dog,thin wall,sleep loss,B_A
An increase in schedule conflict leads to more room repair during meeting reschedule.,No,schedule conflict,room repair,meeting reschedule,B_A
An increase in truck shortage leads to more move delay and an increase in permit delay leads to more move delay.,Yes,truck shortage,permit delay,move delay,B_A
An increase in airline strike leads to more storm front during flight cancellation.,No,airline strike,storm front,flight cancellation,B_A
An increase in cable cut leads to more network outage and an increase in power surge leads to more network outage.,Yes,cable cut,power surge,network outage,B_A
An increase in rockslide risk leads to more tunnel repair during route closure.,No,rockslide risk,tunnel repair,route closure,B_A
An increase in policy error leads to more refund backlog and an increase in bank holiday leads to more refund backlog.,Yes,policy error,bank holiday,refund backlog,B_A
An increase in bug bite leads to more poison ivy during skin rash.,No,bug bite,poison ivy,skin rash,B_A
An increase in policy change leads to more training workshop and an increase in skill gap leads to more training workshop.,Yes,policy change,skill gap,training workshop,B_A
An increase in festival permit leads to more water advisory during public notice.,No,festival permit,water advisory,public notice,B_A
An increase in printer jam leads to more service ticket and an increase in login error leads to more service ticket.,Yes,printer jam,login error,service ticket,B_A
