data,label,X,Y,Z,Classification
Will science showcase cause the increase of jazz solo practice and improvisation fluency?,No,jazz solo practice,improvisation fluency,science showcase,O_D
Will the increase of word puzzles cause problem analysis during charity dinner?,Yes,word puzzles,problem analysis,charity dinner,O_D
Will city lecture cause the increase of canoe races and water speed?,No,canoe races,water speed,city lecture,O_D
Will the increase of stair climbing cause cardiovascular fitness during orchestra rehearsal?,Yes,stair climbing,cardiovascular fitness,orchestra rehearsal,O_D
Will robotics expo cause the increase of storytelling performances and audience engagement?,No,storytelling performances,audience engagement,robotics expo,O_D
Will the increase of wilderness first aid courses cause emergency knowledge during book festival?,Yes,wilderness first aid courses,emergency knowledge,book festival,O_D
Will neighborhood gala cause the increase of welding apprenticeships and joint durability?,No,welding apprenticeships,joint durability,neighborhood gala,O_D
Will the increase of rowing sessions cause core strength during poetry recital?,Yes,rowing sessions,core strength,poetry recital,O_D
Will cultural pageant cause the increase of programming design patterns and architecture skill?,No,programming design patterns,architecture skill,cultural pageant,O_D
Will the increase of logic riddles cause analytical reasoning during craft exhibition?,Yes,logic riddles,analytical reasoning,craft exhibition,O_D
Will medieval banquet cause the increase of underwater diving sessions and buoyancy control?,No,underwater diving sessions,buoyancy control,medieval banquet,O_D
Will the increase of emergency evacuation drills cause survival readiness during lantern festival?,Yes,emergency evacuation drills,survival readiness,lantern festival,O_D
Will childrens carnival cause the increase of call center roleplays and communication clarity?,No,call center roleplays,communication clarity,childrens carnival,O_D
Will the increase of yoga flows cause posture control during theater gala?,Yes,yoga flows,posture control,theater gala,O_D
Will winter chess gala cause the increase of astronomy telescope logs and star detail?,No,astronomy telescope logs,star detail,winter chess gala,O_D
Will the increase of case study analysis cause problem evaluation during regional art show?,Yes,case study analysis,problem evaluation,regional art show,O_D
Will municipal parade cause the increase of bee keeping drills and hive safety?,No,bee keeping drills,hive safety,municipal parade,O_D
Will the increase of circuit training cause cardio strength during museum reopening?,Yes,circuit training,cardio strength,museum reopening,O_D
Will student showcase cause the increase of environmental surveys and conservation insight?,No,environmental surveys,conservation insight,student showcase,O_D
Will the increase of literature circles cause comprehension depth during city parade?,Yes,literature circles,comprehension depth,city parade,O_D
Will autumn market cause the increase of financial portfolio reviews and investment insight?,No,financial portfolio reviews,investment insight,autumn market,O_D
Will the increase of orchestra sectionals cause ensemble cohesion during historical reenactment?,Yes,orchestra sectionals,ensemble cohesion,historical reenactment,O_D
Will city dinner cause the increase of puzzle mazes and spatial planning?,No,puzzle mazes,spatial planning,city dinner,O_D
Will the increase of mnemonic devices cause study preparation during vintage market?,Yes,mnemonic devices,study preparation,vintage market,O_D
Will folk celebration cause the increase of climate debate groups and policy articulation?,No,climate debate groups,policy articulation,folk celebration,O_D
Will the increase of sprint cycling cause athletic power during political convention?,Yes,sprint cycling,athletic power,political convention,O_D
Will local feast cause the increase of meteorology lectures and forecast understanding?,No,meteorology lectures,forecast understanding,local feast,O_D
Will the increase of mural painting cause creative expression during cultural banquet?,Yes,mural painting,creative expression,cultural banquet,O_D
Will museum ceremony cause the increase of mythology readings and imagination growth?,No,mythology readings,imagination growth,museum ceremony,O_D
Will the increase of sign language practice cause communication skill during garden exhibition?,Yes,sign language practice,communication skill,garden exhibition,O_D
Will cultural parade cause the increase of paper recycling workshops and waste reduction?,No,paper recycling workshops,waste reduction,cultural parade,O_D
Will the increase of coding puzzles cause logic precision during school theater night?,Yes,coding puzzles,logic precision,school theater night,O_D
Will town anniversary cause the increase of forensic labs and evidence accuracy?,No,forensic labs,evidence accuracy,town anniversary,O_D
Will the increase of plant grafting cause crop diversity during neighborhood flea market?,Yes,plant grafting,crop diversity,neighborhood flea market,O_D
Will harbor craft fair cause the increase of sailing races and navigation timing?,No,sailing races,navigation timing,harbor craft fair,O_D
Will the increase of coding pair exercises cause debugging efficiency during literature night?,Yes,coding pair exercises,debugging efficiency,literature night,O_D
Will winter showcase cause the increase of mosaic tile workshops and color alignment?,No,mosaic tile workshops,color alignment,winter showcase,O_D
Will the increase of cycling drills cause lung endurance during fireworks show?,Yes,cycling drills,lung endurance,fireworks show,O_D
Will seaside banquet cause the increase of archery stance practice and arrow precision?,No,archery stance practice,arrow precision,seaside banquet,O_D
Will the increase of first aid simulations cause survival outcomes during design expo?,Yes,first aid simulations,survival outcomes,design expo,O_D
Will civic tribute cause the increase of piano quartets and melody synchronization?,No,piano quartets,melody synchronization,civic tribute,O_D
Will the increase of spelling competitions cause word accuracy during alumni reunion?,Yes,spelling competitions,word accuracy,alumni reunion,O_D
Will city reunion cause the increase of sculpture casting lessons and mold accuracy?,No,sculpture casting lessons,mold accuracy,city reunion,O_D
Will the increase of mindfulness retreats cause stress recovery during opera premiere?,Yes,mindfulness retreats,stress recovery,opera premiere,O_D
Will autumn fair cause the increase of field hockey practice and stick control?,No,field hockey practice,stick control,autumn fair,O_D
Will the increase of basketball drills cause shooting accuracy during lantern parade?,Yes,basketball drills,shooting accuracy,lantern parade,O_D
Will civic memorial cause the increase of chemistry titration practice and measurement precision?,No,chemistry titration practice,measurement precision,civic memorial,O_D
Will the increase of leadership workshops cause organizational skill during antique exhibition?,Yes,leadership workshops,organizational skill,antique exhibition,O_D
Will folk gala cause the increase of calligraphy brush work and stroke balance?,No,calligraphy brush work,stroke balance,folk gala,O_D
Will the increase of budgeting drills cause expense control during poetry slam night?,Yes,budgeting drills,expense control,poetry slam night,O_D
Will museum reception cause the increase of choir harmonies and vocal depth?,No,choir harmonies,vocal depth,museum reception,O_D
Will the increase of mindfulness stretches cause body calmness during city sports rally?,Yes,mindfulness stretches,body calmness,city sports rally,O_D
Will harvest banquet cause the increase of coding style reviews and code consistency?,No,coding style reviews,code consistency,harvest banquet,O_D
Will the increase of climbing wall sessions cause grip strength during town parade?,Yes,climbing wall sessions,grip strength,town parade,O_D
Will literary contest cause the increase of rescue training and lifesaving skill?,No,rescue training,lifesaving skill,literary contest,O_D
Will the increase of yoga breathing cause oxygen efficiency during art festival?,Yes,yoga breathing,oxygen efficiency,art festival,O_D
Will spring kite festival cause the increase of pottery exhibitions and artisan showcasing?,No,pottery exhibitions,artisan showcasing,spring kite festival,O_D
Will the increase of violin etudes cause bow accuracy during public lecture?,Yes,violin etudes,bow accuracy,public lecture,O_D
Will book signing cause the increase of team brainstorming sessions and creative generation?,No,team brainstorming sessions,creative generation,book signing,O_D
Will the increase of signboard design cause visual creativity during cultural exchange fair?,Yes,signboard design,visual creativity,cultural exchange fair,O_D
Will market gala cause the increase of economic policy debates and fiscal articulation?,No,economic policy debates,fiscal articulation,market gala,O_D
Will the increase of leadership debates cause debate confidence during city awards night?,Yes,leadership debates,debate confidence,city awards night,O_D
Will summer lecture cause the increase of physics problem sets and solution accuracy?,No,physics problem sets,solution accuracy,summer lecture,O_D
Will the increase of typing challenges cause reaction speed during garden fair?,Yes,typing challenges,reaction speed,garden fair,O_D
Will winter play cause the increase of archery equipment tuning and shooting steadiness?,No,archery equipment tuning,shooting steadiness,winter play,O_D
Will the increase of reading clubs cause reading insight during local election?,Yes,reading clubs,reading insight,local election,O_D
Will community reception cause the increase of marine biology projects and ocean knowledge?,No,marine biology projects,ocean knowledge,community reception,O_D
Will the increase of debate groups cause argument structuring during film festival?,Yes,debate groups,argument structuring,film festival,O_D
Will seaside tournament cause the increase of volleyball practice and spiking accuracy?,No,volleyball practice,spiking accuracy,seaside tournament,O_D
Will the increase of gardening workshops cause soil knowledge during art competition?,Yes,gardening workshops,soil knowledge,art competition,O_D
Will literary banquet cause the increase of triathlon drills and endurance diversity?,No,triathlon drills,endurance diversity,literary banquet,O_D
Will the increase of teamwork retreats cause group trust during museum lecture?,Yes,teamwork retreats,group trust,museum lecture,O_D
Will harvest celebration cause the increase of meteorology stations and climate tracking?,No,meteorology stations,climate tracking,harvest celebration,O_D
Will the increase of sprint swimming cause lung conditioning during council debate?,Yes,sprint swimming,lung conditioning,council debate,O_D
Will spring gala cause the increase of hand weaving and fabric consistency?,No,hand weaving,fabric consistency,spring gala,O_D
Will the increase of leadership seminars cause decision-making skill during public concert?,Yes,leadership seminars,decision-making skill,public concert,O_D
Will town fair cause the increase of lifesaving drills and rescue readiness?,No,lifesaving drills,rescue readiness,town fair,O_D
Will the increase of balance board training cause motor control during park festival?,Yes,balance board training,motor control,park festival,O_D
Will historical gala cause the increase of clay sculpting workshops and design shaping?,No,clay sculpting workshops,design shaping,historical gala,O_D
Will the increase of pottery wheel training cause hand coordination during civic music day?,Yes,pottery wheel training,hand coordination,civic music day,O_D
Will neighborhood poetry day cause the increase of recycling bin placements and plastic waste reduction?,No,recycling bin placements,plastic waste reduction,neighborhood poetry day,O_D
Will the increase of fire safety drills cause hazard response during poetry contest?,Yes,fire safety drills,hazard response,poetry contest,O_D
Will podcast recording cause the increase of dishwashing and sponge wear?,No,dishwashing,sponge wear,podcast recording,O_D
Will the increase of robotics practice cause mechanical accuracy during lantern launch?,Yes,robotics practice,mechanical accuracy,lantern launch,O_D
Will public art exhibition week cause the increase of online recipe shares and more kitchen gadget sales?,No,online recipe shares,more kitchen gadget sales,public art exhibition week,O_D
Will the increase of marathon training cause endurance range during charity picnic?,Yes,marathon training,endurance range,charity picnic,O_D
Will wellness newsletter release cause the increase of hydration tracking and energy levels?,No,hydration tracking,energy levels,wellness newsletter release,O_D
Will the increase of online research cause source reliability during art symposium?,Yes,online research,source reliability,art symposium,O_D
Will music in the park day cause the increase of crosswalk repaints and pedestrian yielding behavior?,No,crosswalk repaints,pedestrian yielding behavior,music in the park day,O_D
Will the increase of team mentoring cause leadership growth during book discussion?,Yes,team mentoring,leadership growth,book discussion,O_D
Will parent-teacher conference week cause the increase of school workload and student pressure reports?,No,school workload,student pressure reports,parent-teacher conference week,O_D
Will the increase of piano sonatas practice cause finger agility during local theater gala?,Yes,piano sonatas practice,finger agility,local theater gala,O_D
Will school supply donation week cause the increase of library fine forgiveness ads and book return rates?,No,library fine forgiveness ads,book return rates,school supply donation week,O_D
Will the increase of financial analysis sessions cause budget insight during antique showcase?,Yes,financial analysis sessions,budget insight,antique showcase,O_D
Will video editing cause the increase of water bottle use and table spills?,No,water bottle use,table spills,video editing,O_D
Will the increase of table tennis drills cause racket precision during folk music night?,Yes,table tennis drills,racket precision,folk music night,O_D
Will product vision meeting cause the increase of code reviews and software reliability?,No,code reviews,software reliability,product vision meeting,O_D
Will the increase of first responder drills cause emergency accuracy during lantern fair?,Yes,first responder drills,emergency accuracy,lantern fair,O_D
Will writing challenge week cause the increase of writing prompts and creative output?,No,writing prompts,creative output,writing challenge week,O_D
Will the increase of handwriting practice cause penmanship skill during film celebration?,Yes,handwriting practice,penmanship skill,film celebration,O_D
Will community cookbook release day cause the increase of streetlight repairs and nighttime traffic safety?,No,streetlight repairs,nighttime traffic safety,community cookbook release day,O_D
Will the increase of time management drills cause scheduling efficiency during local choir show?,Yes,time management drills,scheduling efficiency,local choir show,O_D
Will health and safety week cause the increase of unit tests and greater code correctness?,No,unit tests,greater code correctness,health and safety week,O_D
Will the increase of workplace seminars cause job readiness during riverfront concert?,Yes,workplace seminars,job readiness,riverfront concert,O_D
Will product feedback forum cause the increase of reading assignments and class discussion quality?,No,reading assignments,class discussion quality,product feedback forum,O_D
Will the increase of digital language apps cause vocabulary range during architecture unveiling?,Yes,digital language apps,vocabulary range,architecture unveiling,O_D
Will user research debrief cause the increase of task breakdowns and execution speed?,No,task breakdowns,execution speed,user research debrief,O_D
Will the increase of swimming endurance sets cause breath control during children science fair?,Yes,swimming endurance sets,breath control,children science fair,O_D
Will operations alignment session cause the increase of app walkthroughs and onboarding success?,No,app walkthroughs,onboarding success,operations alignment session,O_D
Will the increase of violin rehearsals cause bowing technique during artisan market?,Yes,violin rehearsals,bowing technique,artisan market,O_D
Will process improvement week cause the increase of focus techniques and productivity levels?,No,focus techniques,productivity levels,process improvement week,O_D
Will the increase of mindfulness walks cause emotional clarity during river crossing festival?,Yes,mindfulness walks,emotional clarity,river crossing festival,O_D
Will editorial planning meeting cause the increase of revision logs and publication accuracy?,No,revision logs,publication accuracy,editorial planning meeting,O_D
Will the increase of debate tournaments cause reasoning clarity during equestrian parade?,Yes,debate tournaments,reasoning clarity,equestrian parade,O_D
Will team reflection lunch cause the increase of self-reflection prompts and goal alignment?,No,self-reflection prompts,goal alignment,team reflection lunch,O_D
Will the increase of sketch competitions cause art technique during medieval fair?,Yes,sketch competitions,art technique,medieval fair,O_D
Will party cause the increase of exercise routines and cardiovascular health?,No,exercise routines,cardiovascular health,party,O_D
Will the increase of circuit training sets cause aerobic output during city comedy night?,Yes,circuit training sets,aerobic output,city comedy night,O_D
Will a focus reset session cause the increase of documentation guides and better team understanding?,No,documentation guides,better team understanding,a focus reset session,O_D
Will the increase of robotics competitions cause design accuracy during naval ceremony?,Yes,robotics competitions,design accuracy,naval ceremony,O_D
Will peer feedback session cause the increase of rehearsal drills and presentation fluency?,No,rehearsal drills,presentation fluency,peer feedback session,O_D
Will the increase of triathlon practice cause athletic range during lantern ceremony?,Yes,triathlon practice,athletic range,lantern ceremony,O_D
Will online chess matches cause the increase of fan usage and blown papers?,No,fan usage,blown papers,online chess matches,O_D
Will the increase of songwriting groups cause lyrical creativity during mountain festival?,Yes,songwriting groups,lyrical creativity,mountain festival,O_D
Will outdoor chess tournament cause the increase of duck crossing signs and driver slowdown reports?,No,duck crossing signs,driver slowdown reports,outdoor chess tournament,O_D
Will the increase of scuba training cause underwater control during theater rehearsal?,Yes,scuba training,underwater control,theater rehearsal,O_D
Will the process clarity briefing cause the increase of learning modules and greater knowledge retention?,No,learning modules,greater knowledge retention,the process clarity briefing,O_D
Will the increase of civic volunteering cause social support during annual auction?,Yes,civic volunteering,social support,annual auction,O_D
Will training calendar launch cause the increase of deadline tracking and project success?,No,deadline tracking,project success,training calendar launch,O_D
An increase in math tutoring leads to an increase in exam success during city marathon.,Yes,math tutoring,exam success,city marathon,O_A
An increase in neighborhood fundraiser leads to an increase in both astronomy simulations and telescope skill.,No,astronomy simulations,telescope skill,neighborhood fundraiser,O_A
An increase in plant watering leads to an increase in flower growth during office relocation.,Yes,plant watering,flower growth,office relocation,O_A
An increase in community art show leads to an increase in both geology fieldwork and rock identification.,No,geology fieldwork,rock identification,community art show,O_A
An increase in note-taking leads to an increase in memory recall during neighborhood garage sale.,Yes,note-taking,memory recall,neighborhood garage sale,O_A
An increase in annual garden expo leads to an increase in both coding competitions and algorithm speed.,No,coding competitions,algorithm speed,annual garden expo,O_A
An increase in stretching drills leads to an increase in flexibility during mayors birthday celebration.,Yes,stretching drills,flexibility,mayors birthday celebration,O_A
An increase in museum lecture week leads to an increase in both photography editing and image sharpness.,No,photography editing,image sharpness,museum lecture week,O_A
An increase in protein intake leads to an increase in muscle gain during film awards ceremony.,Yes,protein intake,muscle gain,film awards ceremony,O_A
An increase in winter carnival leads to an increase in both electrical circuits practice and wiring knowledge.,No,electrical circuits practice,wiring knowledge,winter carnival,O_A
An increase in driving lessons leads to an increase in road safety during spring flower show.,Yes,driving lessons,road safety,spring flower show,O_A
An increase in local band rehearsal leads to an increase in both debate essays and argument clarity.,No,debate essays,argument clarity,local band rehearsal,O_A
An increase in running drills leads to an increase in endurance capacity during rooftop concert.,Yes,running drills,endurance capacity,rooftop concert,O_A
An increase in school carnival leads to an increase in both climate simulations and weather prediction skill.,No,climate simulations,weather prediction skill,school carnival,O_A
An increase in volunteer hours leads to an increase in community trust during antique car show.,Yes,volunteer hours,community trust,antique car show,O_A
An increase in spring lantern event leads to an increase in both paleontology digs and fossil recognition.,No,paleontology digs,fossil recognition,spring lantern event,O_A
An increase in practice matches leads to an increase in team cohesion during city council debate.,Yes,practice matches,team cohesion,city council debate,O_A
An increase in civic ribbon cutting leads to an increase in both cartoon drawing and animation accuracy.,No,cartoon drawing,animation accuracy,civic ribbon cutting,O_A
An increase in music rehearsals leads to an increase in performance quality during tax season.,Yes,music rehearsals,performance quality,tax season,O_A
An increase in cultural storytelling night leads to an increase in both economics case studies and policy insight.,No,economics case studies,policy insight,cultural storytelling night,O_A
An increase in swimming drills leads to an increase in water confidence during theater premiere.,Yes,swimming drills,water confidence,theater premiere,O_A
An increase in city choir gala leads to an increase in both software deployment drills and system stability.,No,software deployment drills,system stability,city choir gala,O_A
An increase in sleep planning leads to an increase in alertness during cycling expo.,Yes,sleep planning,alertness,cycling expo,O_A
An increase in autumn lecture leads to an increase in both programming puzzles and concept reasoning.,No,programming puzzles,concept reasoning,autumn lecture,O_A
An increase in speech writing leads to an increase in rhetorical skill during construction week.,Yes,speech writing,rhetorical skill,construction week,O_A
An increase in regional sports awards leads to an increase in both astronomy readings and constellation recall.,No,astronomy readings,constellation recall,regional sports awards,O_A
An increase in software testing leads to an increase in code stability during spring carnival.,Yes,software testing,code stability,spring carnival,O_A
An increase in science film night leads to an increase in both economic modeling and forecasting accuracy.,No,economic modeling,forecasting accuracy,science film night,O_A
An increase in walking sessions leads to an increase in calorie burning during food tasting festival.,Yes,walking sessions,calorie burning,food tasting festival,O_A
An increase in student invention fair leads to an increase in both opera rehearsals and vocal discipline.,No,opera rehearsals,vocal discipline,student invention fair,O_A
An increase in singing lessons leads to an increase in vocal range during tech product launch.,Yes,singing lessons,vocal range,tech product launch,O_A
An increase in spring flower contest leads to an increase in both team projects and collaboration fluency.,No,team projects,collaboration fluency,spring flower contest,O_A
An increase in CPR training leads to an increase in survival skill during parade rehearsal.,Yes,CPR training,survival skill,parade rehearsal,O_A
An increase in fashion show event leads to an increase in both zoology field practice and species data.,No,zoology field practice,species data,fashion show event,O_A
An increase in jogging drills leads to an increase in breathing efficiency during art award ceremony.,Yes,jogging drills,breathing efficiency,art award ceremony,O_A
An increase in museum gala leads to an increase in both documentary filming and editing skill.,No,documentary filming,editing skill,museum gala,O_A
An increase in stretching routines leads to an increase in back strength during annual poetry slam.,Yes,stretching routines,back strength,annual poetry slam,O_A
An increase in town picnic leads to an increase in both poetry readings and literary recall.,No,poetry readings,literary recall,town picnic,O_A
An increase in hydration planning leads to an increase in athletic readiness during music recital.,Yes,hydration planning,athletic readiness,music recital,O_A
