data,label,X,Y,Z,Classification
Will the increase of umbrella sales cause traffic jams during monsoon season?,No,umbrella sales,traffic jams,monsoon season,B_D
Will canyon trek cause the increase of hiking boot rentals and rescue drone flights?,Yes,hiking boot rentals,rescue drone flights,canyon trek,B_D
Will the increase of accounting software subscriptions cause stress complaints during tax season?,No,accounting software subscriptions,stress complaints,tax season,B_D
Will jazz festival cause the increase of concert program sales and subway maintenance alerts?,Yes,concert program sales,subway maintenance alerts,jazz festival,B_D
Will the increase of campus cafeteria sales cause parking violations during university orientation?,No,campus cafeteria sales,parking violations,university orientation,B_D
Will stargazing festival cause the increase of astronomy telescope sales and dark sky complaints?,Yes,astronomy telescope sales,dark sky complaints,stargazing festival,B_D
Will the increase of farm equipment rentals cause rural traffic congestion during harvest season?,No,farm equipment rentals,rural traffic congestion,harvest season,B_D
Will street crafts fair cause the increase of handmade jewelry sales and police permit checks?,Yes,handmade jewelry sales,police permit checks,street crafts fair,B_D
Will the increase of car rentals cause highway bottlenecks during commuter rail strike?,No,car rentals,highway bottlenecks,commuter rail strike,B_D
Will outdoor influencer meetup cause the increase of smartphone tripod sales and lost item claims?,Yes,smartphone tripod sales,lost item claims,outdoor influencer meetup,B_D
Will the increase of bicycle commuting cause detour traffic reports during road maintenance?,No,bicycle commuting,detour traffic reports,road maintenance,B_D
Will coastal food market week cause the increase of seafood stall sales and food recall warnings?,Yes,seafood stall sales,food recall warnings,coastal food market week,B_D
Will the increase of smartphone purchases cause mall crowding complaints during new smartphone launch?,No,smartphone purchases,mall crowding complaints,new smartphone launch,B_D
Will retro fashion expo cause the increase of vintage clothing sales and storage overflow notices?,Yes,vintage clothing sales,storage overflow notices,retro fashion expo,B_D
Will the increase of hotel conference room bookings cause airport taxi queues during major conference?,No,hotel conference room bookings,airport taxi queues,major conference,B_D
Will derby rivalry cause the increase of football scarf sales and train station reroutes?,Yes,football scarf sales,train station reroutes,derby rivalry,B_D
Will the increase of museum visits cause gallery wait times during art biennale?,No,museum visits,gallery wait times,art biennale,B_D
Will renewable energy fair cause the increase of solar water heater purchases and roof leak reports?,Yes,solar water heater purchases,roof leak reports,renewable energy fair,B_D
Will the increase of public transit rides cause polling station parking shortages during local election day?,No,public transit rides,polling station parking shortages,local election day,B_D
Will online gaming marathon cause the increase of e-sport chair sales and power strip failures?,Yes,e-sport chair sales,power strip failures,online gaming marathon,B_D
Will the increase of space heater purchases cause frozen pipe incidents during cold snap?,No,space heater purchases,frozen pipe incidents,cold snap,B_D
Will coastal surf festival cause the increase of surfboard sales and injury clinic visits?,Yes,surfboard sales,injury clinic visits,coastal surf festival,B_D
Will the increase of fog light purchases cause fender-bender accidents during heavy fog mornings?,No,fog light purchases,fender-bender accidents,heavy fog mornings,B_D
Will plastic-free month cause the increase of eco-bag sales and scanning delays?,Yes,eco-bag sales,scanning delays,plastic-free month,B_D
Will the increase of gasoline purchases cause emergency shelter check-ins during hurricane evacuation advisory?,No,gasoline purchases,emergency shelter check-ins,hurricane evacuation advisory,B_D
Will virtual reality showcase cause the increase of VR headset rentals and dizziness reports?,Yes,VR headset rentals,dizziness reports,virtual reality showcase,B_D
Will the increase of air purifier sales cause respiratory clinic visits during air quality alerts?,No,air purifier sales,respiratory clinic visits,air quality alerts,B_D
Will children carnival cause the increase of ice cream truck visits and traffic control posts?,Yes,ice cream truck visits,traffic control posts,children carnival,B_D
Will the increase of rain barrel sales cause lawn watering fines during drought restrictions?,No,rain barrel sales,lawn watering fines,drought restrictions,B_D
Will reef diving festival cause the increase of diving mask sales and coral damage reports?,Yes,diving mask sales,coral damage reports,reef diving festival,B_D
Will the increase of compost bin purchases cause overflowing trash complaints during garbage collection delays?,No,compost bin purchases,overflowing trash complaints,garbage collection delays,B_D
Will outdoor cooking event cause the increase of camping stove rentals and gas leak alerts?,Yes,camping stove rentals,gas leak alerts,outdoor cooking event,B_D
Will the increase of team merchandise sales cause stadium traffic backups during school sports championship?,No,team merchandise sales,stadium traffic backups,school sports championship,B_D
Will family expo cause the increase of childrens toy sales and missing child announcements?,Yes,childrens toy sales,missing child announcements,family expo,B_D
Will the increase of garden soil sales cause nursery checkout lines during spring planting season?,No,garden soil sales,nursery checkout lines,spring planting season,B_D
Will summer regatta cause the increase of boat rental requests and rescue siren calls?,Yes,boat rental requests,rescue siren calls,summer regatta,B_D
Will the increase of local craft market sales cause package delivery delays during shipping strike?,No,local craft market sales,package delivery delays,shipping strike,B_D
Will travel photography expo cause the increase of photography tripod purchases and luggage delays?,Yes,photography tripod purchases,luggage delays,travel photography expo,B_D
Will the increase of generic brand purchases cause product stockouts during supply chain disruptions?,No,generic brand purchases,product stockouts,supply chain disruptions,B_D
Will health food convention cause the increase of smoothie bar sales and refrigeration failures?,Yes,smoothie bar sales,refrigeration failures,health food convention,B_D
Will the increase of fresh produce sales cause street vendor permit checks during farmers market opening?,No,fresh produce sales,street vendor permit checks,farmers market opening,B_D
Will mountain trek festival cause the increase of hiking tent sales and flood warnings?,Yes,hiking tent sales,flood warnings,mountain trek festival,B_D
Will the increase of printer paper purchases cause late-night lab usage during college application deadline?,No,printer paper purchases,late-night lab usage,college application deadline,B_D
Will costume parade cause the increase of children costume sales and safety code violations?,Yes,children costume sales,safety code violations,costume parade,B_D
Will the increase of LED bulb purchases cause energy bill inquiries during electricity rate hike month?,No,LED bulb purchases,energy bill inquiries,electricity rate hike month,B_D
Will mindfulness retreat cause the increase of meditation cushion sales and stairwell crowding?,Yes,meditation cushion sales,stairwell crowding,mindfulness retreat,B_D
Will the increase of nasal spray sales cause sick note requests during peak allergy index week?,No,nasal spray sales,sick note requests,peak allergy index week,B_D
Will inline skating event cause the increase of rollerblade rentals and first aid reports?,Yes,rollerblade rentals,first aid reports,inline skating event,B_D
Will the increase of bike rentals cause car lane congestion during citywide bike-to-work day?,No,bike rentals,car lane congestion,citywide bike-to-work day,B_D
Will kitchen appliance expo cause the increase of ice maker sales and water line breaks?,Yes,ice maker sales,water line breaks,kitchen appliance expo,B_D
Will the increase of sunscreen purchases cause ferry delays during coastal holiday?,No,sunscreen purchases,ferry delays,coastal holiday,B_D
Will folk fusion festival cause the increase of electric violin sales and sound check delays?,Yes,electric violin sales,sound check delays,folk fusion festival,B_D
Will the increase of raincoat sales cause bus stop flooding reports during tropical storm watch?,No,raincoat sales,bus stop flooding reports,tropical storm watch,B_D
Will digital heritage month cause the increase of virtual museum ticket sales and streaming buffer issues?,Yes,virtual museum ticket sales,streaming buffer issues,digital heritage month,B_D
Will the increase of hiking boot sales cause rescue calls during mountain trail reopening?,No,hiking boot sales,rescue calls,mountain trail reopening,B_D
Will marine awareness cause the increase of snorkeling gear sales and coral protection warnings?,Yes,snorkeling gear sales,coral protection warnings,marine awareness,B_D
Will the increase of gym signups cause office absenteeism during new year resolution season?,No,gym signups,office absenteeism,new year resolution season,B_D
Will tropical fruit carnival cause the increase of fresh juice stall sales and refrigeration shortages?,Yes,fresh juice stall sales,refrigeration shortages,tropical fruit carnival,B_D
Will the increase of drone purchases cause wildlife disturbance reports during outdoor photography contest?,No,drone purchases,wildlife disturbance reports,outdoor photography contest,B_D
Will sports derby cause the increase of roller derby ticket sales and first responder callouts?,Yes,roller derby ticket sales,first responder callouts,sports derby,B_D
Will the increase of flower bouquet sales cause traffic police deployments during valentine?,No,flower bouquet sales,traffic police deployments,valentine,B_D
Will animation expo cause the increase of digital sketchpad sales and power cord shortages?,Yes,digital sketchpad sales,power cord shortages,animation expo,B_D
Will the increase of cooking oil sales cause fire department warnings during festive cooking?,No,cooking oil sales,fire department warnings,festive cooking,B_D
Will city nightlife cause the increase of rooftop bar entries and traffic checkpoint delays?,Yes,rooftop bar entries,traffic checkpoint delays,city nightlife,B_D
Will the increase of candy sales cause dentist appointments during halloween?,No,candy sales,dentist appointments,halloween,B_D
Will international food expo cause the increase of gourmet cheese purchases and customs inspection delays?,Yes,gourmet cheese purchases,customs inspection delays,international food expo,B_D
Will the increase of turkey purchases cause oven repair calls during thanksgiving dinner week?,No,turkey purchases,oven repair calls,thanksgiving dinner week,B_D
Will archery showcase cause the increase of archery set sales and range safety warnings?,Yes,archery set sales,range safety warnings,archery showcase,B_D
Will the increase of fruit basket sales cause delivery truck breakdowns during lunar new year?,No,fruit basket sales,delivery truck breakdowns,lunar new year,B_D
Will summer kite rally cause the increase of kite purchases and rope entanglement reports?,Yes,kite purchases,rope entanglement reports,summer kite rally,B_D
Will the increase of school uniform sales cause long cashier lines during school reopening month?,No,school uniform sales,long cashier lines,school reopening month,B_D
Will auto innovation week cause the increase of car simulator rentals and electrical fuse replacements?,Yes,car simulator rentals,electrical fuse replacements,auto innovation week,B_D
Will the increase of surfboard rentals cause ambulance calls during beach surfing competition?,No,surfboard rentals,ambulance calls,beach surfing competition,B_D
Will remote education summit cause the increase of virtual classroom logins and password reset spikes?,Yes,virtual classroom logins,password reset spikes,remote education summit,B_D
Will the increase of hiking backpack sales cause bus rescheduling during mountain music festival?,No,hiking backpack sales,bus rescheduling,mountain music festival,B_D
Will open street weekend cause the increase of street food cart sales and waste disposal warnings?,Yes,street food cart sales,waste disposal warnings,open street weekend,B_D
Will the increase of book fair sales cause lost child reports during international book fair?,No,book fair sales,lost child reports,international book fair,B_D
Will spring fair cause the increase of fairground ride tickets and sound permit extensions?,Yes,fairground ride tickets,sound permit extensions,spring fair,B_D
Will the increase of photography equipment sales cause museum theft alerts during photo exhibition?,No,photography equipment sales,museum theft alerts,photo exhibition,B_D
Will adventure sports festival cause the increase of climbing harness sales and rope inspection delays?,Yes,climbing harness sales,rope inspection delays,adventure sports festival,B_D
Will the increase of marathon shoe sales cause dehydration aid calls during city marathon?,No,marathon shoe sales,dehydration aid calls,city marathon,B_D
Will retro music cause the increase of vinyl record sales and storage unit shortages?,Yes,vinyl record sales,storage unit shortages,retro music,B_D
Will the increase of ski lodge reservations cause avalanche warnings during alpine festival?,No,ski lodge reservations,avalanche warnings,alpine festival,B_D
Will rooftop farming month cause the increase of urban farm box sales and elevator overuse complaints?,Yes,urban farm box sales,elevator overuse complaints,rooftop farming month,B_D
Will the increase of tomato seed sales cause irrigation complaints during spring gardening week?,No,tomato seed sales,irrigation complaints,spring gardening week,B_D
Will heritage celebration cause the increase of historical tour bookings and bus lane reroutes?,Yes,historical tour bookings,bus lane reroutes,heritage celebration,B_D
Will the increase of ski goggle sales cause lift line delays during winter sports?,No,ski goggle sales,lift line delays,winter sports,B_D
Will culinary culture week cause the increase of online recipe downloads and grocery restock delays?,Yes,online recipe downloads,grocery restock delays,culinary culture week,B_D
Will the increase of pumpkin sales cause police patrol shifts during harvest fair?,No,pumpkin sales,police patrol shifts,harvest fair,B_D
Will charity concert cause the increase of livestream ticket sales and web server overloads?,Yes,livestream ticket sales,web server overloads,charity concert,B_D
Will the increase of school notebook sales cause public transit congestion during exam registration?,No,school notebook sales,public transit congestion,exam registration,B_D
Will winter sports gala cause the increase of ice rink entry sales and heating system strain?,Yes,ice rink entry sales,heating system strain,winter sports gala,B_D
Will the increase of jewelry sales cause security guard hires during wedding expo?,No,jewelry sales,security guard hires,wedding expo,B_D
Will anglers showcase day cause the increase of fishing bait sales and riverbank congestion?,Yes,fishing bait sales,riverbank congestion,anglers showcase day,B_D
Will the increase of pet costume sales cause parking lot shortages during pet parade?,No,pet costume sales,parking lot shortages,pet parade,B_D
Will green home month cause the increase of indoor plant sales and humidity control problems?,Yes,indoor plant sales,humidity control problems,green home month,B_D
Will the increase of souvenir sales cause luggage overweight fines during regional fair?,No,souvenir sales,luggage overweight fines,regional fair,B_D
Will auto tech cause the increase of self-driving car demo rides and GPS recalibration reports?,Yes,self-driving car demo rides,GPS recalibration reports,auto tech,B_D
Will the increase of wool coat purchases cause heating system failures during icy wind?,No,wool coat purchases,heating system failures,icy wind,B_D
Will forest leisure cause the increase of portable hammock sales and tree damage reports?,Yes,portable hammock sales,tree damage reports,forest leisure,B_D
Will the increase of solar panel installations cause transformer overloads during green energy rebate month?,No,solar panel installations,transformer overloads,green energy rebate month,B_D
Will forest night trek cause the increase of camping lantern rentals and path obstruction reports?,Yes,camping lantern rentals,path obstruction reports,forest night trek,B_D
Will the increase of rain boot sales cause sewer blockage reports during flash flood warning?,No,rain boot sales,sewer blockage reports,flash flood warning,B_D
Will digital music gala cause the increase of online concert ticket sales and livestream lag reports?,Yes,online concert ticket sales,livestream lag reports,digital music gala,B_D
Will the increase of fitness tracker sales cause gym overcrowding during corporate wellness month?,No,fitness tracker sales,gym overcrowding,corporate wellness month,B_D
Will alpine snow week cause the increase of ski lift ticket sales and shuttle bus breakdowns?,Yes,ski lift ticket sales,shuttle bus breakdowns,alpine snow week,B_D
Will the increase of fireworks sales cause ambulance siren calls during midsummer fireworks night?,No,fireworks sales,ambulance siren calls,midsummer fireworks night,B_D
Will mobility awareness day cause the increase of electric scooter hires and curbside accident alerts?,Yes,electric scooter hires,curbside accident alerts,mobility awareness day,B_D
Will the increase of karaoke bar entries cause taxi shortage reports during nightlife festival?,No,karaoke bar entries,taxi shortage reports,nightlife festival,B_D
Will education innovation cause the increase of online lecture views and microphone failure reports?,Yes,online lecture views,microphone failure reports,education innovation,B_D
Will the increase of fruit juice sales cause stomach upset reports during tropical fruit fair?,No,fruit juice sales,stomach upset reports,tropical fruit fair,B_D
Will urban cycling fair cause the increase of bike lock sales and key duplication warnings?,Yes,bike lock sales,key duplication warnings,urban cycling fair,B_D
Will the increase of stroller purchases cause crosswalk congestion during baby expo?,No,stroller purchases,crosswalk congestion,baby expo,B_D
Will hydration awareness day cause the increase of reusable bottle sales and dispenser shortage complaints?,Yes,reusable bottle sales,dispenser shortage complaints,hydration awareness day,B_D
Will the increase of bottled juice sales cause ambulance deployments during heatstroke drill day?,No,bottled juice sales,ambulance deployments,heatstroke drill day,B_D
Will canyon climbing cause the increase of hiking rope purchases and rescue helicopter delays?,Yes,hiking rope purchases,rescue helicopter delays,canyon climbing,B_D
Will the increase of smart speaker sales cause network instability reports during tech discount?,No,smart speaker sales,network instability reports,tech discount,B_D
Will culinary festival cause the increase of gourmet spice sales and shipment backlog?,Yes,gourmet spice sales,shipment backlog,culinary festival,B_D
Will the increase of vegetable seed sales cause irrigation line breaks during agricultural fair?,No,vegetable seed sales,irrigation line breaks,agricultural fair,B_D
Will mountain wellness cause the increase of hiking stick sales and first responder delays?,Yes,hiking stick sales,first responder delays,mountain wellness,B_D
Will the increase of frozen dinner sales cause microwave repair calls during frozen foods month?,No,frozen dinner sales,microwave repair calls,frozen foods month,B_D
Will autumn harvest fair cause the increase of harvest basket sales and tractor detours?,Yes,harvest basket sales,tractor detours,autumn harvest fair,B_D
Will the increase of smoothie shop visits cause bicycle parking shortages during wellness?,No,smoothie shop visits,bicycle parking shortages,wellness,B_D
Will green education cause the increase of reusable notebook sales and printer error reports?,Yes,reusable notebook sales,printer error reports,green education,B_D
Will the increase of fireworks permit requests cause police crowd control shifts during independence celebration?,No,fireworks permit requests,police crowd control shifts,independence celebration,B_D
Will artisans gathering cause the increase of pottery glaze purchases and chemical spill reports?,Yes,pottery glaze purchases,chemical spill reports,artisans gathering,B_D
Will the increase of winter coat donations cause heating voucher shortages during charity drive week?,No,winter coat donations,heating voucher shortages,charity drive week,B_D
Will renewable cooking fair cause the increase of solar oven sales and fire hazard reports?,Yes,solar oven sales,fire hazard reports,renewable cooking fair,B_D
Will the increase of bus pass sales cause ferry overcrowding during intermodal transport festival?,No,bus pass sales,ferry overcrowding,intermodal transport festival,B_D
Will urban health expo cause the increase of air purifier rentals and filter backlog notices?,Yes,air purifier rentals,filter backlog notices,urban health expo,B_D
Will the increase of bottled tea sales cause headache clinic visits during exam cramming?,No,bottled tea sales,headache clinic visits,exam cramming,B_D
Will ocean sports carnival cause the increase of surfboard rentals and wave injury alerts?,Yes,surfboard rentals,wave injury alerts,ocean sports carnival,B_D
Will the increase of hot chocolate sales cause tent shortage reports during winter carnival?,No,hot chocolate sales,tent shortage reports,winter carnival,B_D
Will heritage dance festival cause the increase of cultural dance ticket sales and shoe shortage notices?,Yes,cultural dance ticket sales,shoe shortage notices,heritage dance festival,B_D
Will the increase of lantern sales cause parking ticket spikes during cultural light parade?,No,lantern sales,parking ticket spikes,cultural light parade,B_D
Will frozen arts gala cause the increase of ice sculpture sales and chiller breakdowns?,Yes,ice sculpture sales,chiller breakdowns,frozen arts gala,B_D
Will the increase of student ID renewals cause hallway congestion during semester start?,No,student ID renewals,hallway congestion,semester start,B_D
Will e-sports convention cause the increase of gaming headset sales and account reset requests?,Yes,gaming headset sales,account reset requests,e-sports convention,B_D
Will the increase of life jacket rentals cause dock crowding during boating safety?,No,life jacket rentals,dock crowding,boating safety,B_D
Will storm preparedness cause the increase of weather app downloads and signal outage complaints?,Yes,weather app downloads,signal outage complaints,storm preparedness,B_D
Will the increase of electric bicycle rentals cause bridge congestion during eco-transport festival?,No,electric bicycle rentals,bridge congestion,eco-transport festival,B_D
Will park leisure day cause the increase of outdoor hammock sales and tree inspection reports?,Yes,outdoor hammock sales,tree inspection reports,park leisure day,B_D
Will the increase of corn-on-cob sales cause farm animal escapes during rural harvest carnival?,No,corn-on-cob sales,farm animal escapes,rural harvest carnival,B_D
Will eco-fashion month cause the increase of solar watch sales and malfunction returns?,Yes,solar watch sales,malfunction returns,eco-fashion month,B_D
Will the increase of camera purchases cause subway platform delays during travel expo week?,No,camera purchases,subway platform delays,travel expo week,B_D
Will nutrition fair cause the increase of smoothie blender rentals and power socket failures?,Yes,smoothie blender rentals,power socket failures,nutrition fair,B_D
Will the increase of air ticket sales cause parking shortages during international air show?,No,air ticket sales,parking shortages,international air show,B_D
Will equestrian show cause the increase of horse saddle sales and vet clinic checkups?,Yes,horse saddle sales,vet clinic checkups,equestrian show,B_D
Will the increase of fishing bait sales cause coast guard alerts during fishing safety?,No,fishing bait sales,coast guard alerts,fishing safety,B_D
Will motorsport cause the increase of car rally ticket sales and noise ordinance waivers?,Yes,car rally ticket sales,noise ordinance waivers,motorsport,B_D
Will the increase of camping lantern sales cause forest ranger patrols during wilderness safety?,No,camping lantern sales,forest ranger patrols,wilderness safety,B_D
Will city gardening cause the increase of smart garden kit sales and pest control visits?,Yes,smart garden kit sales,pest control visits,city gardening,B_D
Will the increase of bread machine sales cause yeast shortage complaints during home baking month?,No,bread machine sales,yeast shortage complaints,home baking month,B_D
Will farmers bread fair cause the increase of artisan bread sales and oven malfunction reports?,Yes,artisan bread sales,oven malfunction reports,farmers bread fair,B_D
Will the increase of festival wristband sales cause longer bathroom lines during folk festival?,No,festival wristband sales,longer bathroom lines,folk festival,B_D
Will international gastronomy month cause the increase of cultural food tour bookings and taxi delays?,Yes,cultural food tour bookings,taxi delays,international gastronomy month,B_D
Will the increase of tablet purchases cause library Wi-Fi failures during digital learning week?,No,tablet purchases,library Wi-Fi failures,digital learning week,B_D
